{
  "success": true,
  "final_summary": "## Compliance Summary\n\n### Bottom Line\nCounties must document all Workforce Education and Training (WET) programs and ensure they allocate at least 35% of their BHSA funds for WET activities, addressing the needs of the behavioral health delivery system.\n\n### Statutory Basis\n- **W&I Code \u00a7 5892**: Allows use of BHSS funds for workforce recruitment, development, training, and retention.\n- **W&I Code \u00a7 5899**: Mandates that WET activities enhance the behavioral health workforce and promote diversity.\n- **W&I Code \u00a7 5830**: Requires counties to develop a comprehensive workforce education and training program.\n- **W&I Code \u00a7 5840**: Specifies allocation of BHSS funds for WET activities.\n- **W&I Code \u00a7 14184**: Outlines funding guidelines for behavioral health services, including WET.\n\n### Policy Guidance\nCounties \"must\" allocate 35% of BHSA funds for WET and ensure these funds are spent within ten years. WET activities \"should\" focus on increasing diversity and may include stipends for childcare or transportation. Documentation of all WET programs is essential.\n\n### Action Items for County\n1. Document all current and planned WET programs, ensuring alignment with the behavioral health delivery system needs (by March 2024).\n2. Allocate at least 35% of BHSA funds for WET activities and develop a spending plan to comply with the ten-year requirement (by April 2024).\n3. Create a recruitment and retention strategy that includes diversity initiatives and potential support for participants (by June 2024).\n4. Designate a WET coordinator to oversee program administration and coordination (by July 2024).\n\n### Open Questions / Ambiguities\n- Clarification is needed on the specific duration of employment commitments for certain WET activities.\n- Further guidance is required on measuring the impact of diversity initiatives within the workforce.",
  "final_response": "\u2705 **Good Quality** (Score: 8.6/10)\n\n## Compliance Summary\n\n### Bottom Line\nCounties must document all Workforce Education and Training (WET) programs and ensure they allocate at least 35% of their BHSA funds for WET activities, addressing the needs of the behavioral health delivery system.\n\n### Statutory Basis\n- **W&I Code \u00a7 5892**: Allows use of BHSS funds for workforce recruitment, development, training, and retention.\n- **W&I Code \u00a7 5899**: Mandates that WET activities enhance the behavioral health workforce and promote diversity.\n- **W&I Code \u00a7 5830**: Requires counties to develop a comprehensive workforce education and training program.\n- **W&I Code \u00a7 5840**: Specifies allocation of BHSS funds for WET activities.\n- **W&I Code \u00a7 14184**: Outlines funding guidelines for behavioral health services, including WET.\n\n### Policy Guidance\nCounties \"must\" allocate 35% of BHSA funds for WET and ensure these funds are spent within ten years. WET activities \"should\" focus on increasing diversity and may include stipends for childcare or transportation. Documentation of all WET programs is essential.\n\n### Action Items for County\n1. Document all current and planned WET programs, ensuring alignment with the behavioral health delivery system needs (by March 2024).\n2. Allocate at least 35% of BHSA funds for WET activities and develop a spending plan to comply with the ten-year requirement (by April 2024).\n3. Create a recruitment and retention strategy that includes diversity initiatives and potential support for participants (by June 2024).\n4. Designate a WET coordinator to oversee program administration and coordination (by July 2024).\n\n### Open Questions / Ambiguities\n- Clarification is needed on the specific duration of employment commitments for certain WET activities.\n- Further guidance is required on measuring the impact of diversity initiatives within the workforce.\n\n---\n\n**Processing Metadata:**\n- Priority: High\n- Statute Confidence: Low\n- Policy Confidence: Low\n- Relevant Statutes: W&I Code \u00a7 14184, W&I Code \u00a7 5830, W&I Code \u00a7 5840, W&I Code \u00a7 5892, W&I Code \u00a7 5899\n- Revision Count: 0\n\n**Quality Issues Noted:**\n- Missing specific citation for Policy Manual Section 7.A.1 and other sections referenced.\n- The action item for documenting WET programs could specify the format or template to be used.",
  "action_items": [
    "Document all current and planned WET programs, ensuring alignment with the behavioral health delivery system needs (by March 2024).",
    "Allocate at least 35% of BHSA funds for WET activities and develop a spending plan to comply with the ten-year requirement (by April 2024).",
    "Create a recruitment and retention strategy that includes diversity initiatives and potential support for participants (by June 2024).",
    "Designate a WET coordinator to oversee program administration and coordination (by July 2024)."
  ],
  "priority": "High",
  "quality_score": 8.6,
  "passes_review": true,
  "metadata": {
    "statute_confidence": "Low",
    "policy_confidence": "Low",
    "relevant_statutes": [
      "W&I Code \u00a7 14184",
      "W&I Code \u00a7 5830",
      "W&I Code \u00a7 5840",
      "W&I Code \u00a7 5892",
      "W&I Code \u00a7 5899"
    ],
    "revision_count": 0,
    "quality_issues": [
      "Missing specific citation for Policy Manual Section 7.A.1 and other sections referenced.",
      "The action item for documenting WET programs could specify the format or template to be used."
    ],
    "quality_suggestions": [
      "Include full citations for all referenced policy manual sections to enhance clarity.",
      "Specify the format or template for documenting WET programs in action item 1."
    ],
    "statute_chunks_retrieved": 10,
    "policy_chunks_retrieved": 10
  }
}