{
  "success": true,
  "final_summary": "## Compliance Summary\n\n### Bottom Line\nYes, the county must include the development of innovative programs or pilots in its plans as mandated by state statutes and policy guidance.\n\n### Statutory Basis\nCounties are required to develop innovative programs under the following W&I Code sections:\n- **W&I Code \u00a7 5899**: Authorizes counties to create innovative programs within the Behavioral Health Services Fund.\n- **W&I Code \u00a7 5892**: Mandates allocation of funds for innovative behavioral health pilots and projects.\n- **W&I Code \u00a7 5830**: Requires programs that address mental health needs, including innovative approaches.\n- **W&I Code \u00a7 5840**: Obligates counties to plan for innovative strategies in mental health services.\n- **W&I Code \u00a7 14184**: Directs counties to use funds for innovative projects improving mental health services.\n\n### Policy Guidance\nThe DHCS Policy Manual states:\n- Counties **must** develop innovative behavioral health pilots and projects (Section 7.A.6).\n- Counties **must** allocate funds from the Behavioral Health Services Fund for these initiatives.\n- Counties **should** ensure plans include innovative programs as part of their Three-Year Integrated Plan and annual updates.\n\n### Action Items for County\n1. Review and update the county's Three-Year Integrated Plan to include innovative programs or pilots (by March 2024).\n2. Allocate necessary funds from the Behavioral Health Services Fund for these innovative initiatives (ongoing).\n3. Document the development and funding allocation for innovative projects, ensuring compliance with suballocation requirements (by June 2024).\n4. Engage stakeholders to identify potential innovative program ideas and gather input (by April 2024).\n\n### Open Questions / Ambiguities\n- What specific criteria define an \"innovative\" program or pilot?\n- How can counties balance flexibility in fund allocation with mandatory requirements for specific populations? Further clarification from DHCS is needed.",
  "final_response": "\u2705 **Good Quality** (Score: 8.6/10)\n\n## Compliance Summary\n\n### Bottom Line\nYes, the county must include the development of innovative programs or pilots in its plans as mandated by state statutes and policy guidance.\n\n### Statutory Basis\nCounties are required to develop innovative programs under the following W&I Code sections:\n- **W&I Code \u00a7 5899**: Authorizes counties to create innovative programs within the Behavioral Health Services Fund.\n- **W&I Code \u00a7 5892**: Mandates allocation of funds for innovative behavioral health pilots and projects.\n- **W&I Code \u00a7 5830**: Requires programs that address mental health needs, including innovative approaches.\n- **W&I Code \u00a7 5840**: Obligates counties to plan for innovative strategies in mental health services.\n- **W&I Code \u00a7 14184**: Directs counties to use funds for innovative projects improving mental health services.\n\n### Policy Guidance\nThe DHCS Policy Manual states:\n- Counties **must** develop innovative behavioral health pilots and projects (Section 7.A.6).\n- Counties **must** allocate funds from the Behavioral Health Services Fund for these initiatives.\n- Counties **should** ensure plans include innovative programs as part of their Three-Year Integrated Plan and annual updates.\n\n### Action Items for County\n1. Review and update the county's Three-Year Integrated Plan to include innovative programs or pilots (by March 2024).\n2. Allocate necessary funds from the Behavioral Health Services Fund for these innovative initiatives (ongoing).\n3. Document the development and funding allocation for innovative projects, ensuring compliance with suballocation requirements (by June 2024).\n4. Engage stakeholders to identify potential innovative program ideas and gather input (by April 2024).\n\n### Open Questions / Ambiguities\n- What specific criteria define an \"innovative\" program or pilot?\n- How can counties balance flexibility in fund allocation with mandatory requirements for specific populations? Further clarification from DHCS is needed.\n\n---\n\n**Processing Metadata:**\n- Priority: High\n- Statute Confidence: Low\n- Policy Confidence: Low\n- Relevant Statutes: W&I Code \u00a7 14184, W&I Code \u00a7 5830, W&I Code \u00a7 5840, W&I Code \u00a7 5892, W&I Code \u00a7 5899\n- Revision Count: 0\n\n**Quality Issues Noted:**\n- Action item 2 lacks a specific timeline for fund allocation.\n- The 'Open Questions' section could benefit from more detail.",
  "action_items": [
    "Review and update the county's Three-Year Integrated Plan to include innovative programs or pilots (by March 2024).",
    "Allocate necessary funds from the Behavioral Health Services Fund for these innovative initiatives (ongoing).",
    "Document the development and funding allocation for innovative projects, ensuring compliance with suballocation requirements (by June 2024).",
    "Engage stakeholders to identify potential innovative program ideas and gather input (by April 2024)."
  ],
  "priority": "High",
  "quality_score": 8.6,
  "passes_review": true,
  "metadata": {
    "statute_confidence": "Low",
    "policy_confidence": "Low",
    "relevant_statutes": [
      "W&I Code \u00a7 14184",
      "W&I Code \u00a7 5830",
      "W&I Code \u00a7 5840",
      "W&I Code \u00a7 5892",
      "W&I Code \u00a7 5899"
    ],
    "revision_count": 0,
    "quality_issues": [
      "Action item 2 lacks a specific timeline for fund allocation.",
      "The 'Open Questions' section could benefit from more detail."
    ],
    "quality_suggestions": [
      "Specify a timeline for action item 2 to enhance clarity.",
      "Provide more context or examples in the 'Open Questions' section to clarify what constitutes an 'innovative' program."
    ],
    "statute_chunks_retrieved": 10,
    "policy_chunks_retrieved": 10
  }
}