{
  "success": true,
  "final_summary": "## Compliance Summary\n\n### Bottom Line\nCounties must allocate 35% of their Behavioral Health Services Fund for Full Service Partnership (FSP) programs and ensure all providers meet the required standards for BHSA funding.\n\n### Statutory Basis\nNo specific statutory requirement identified.\n\n### Policy Guidance\nCounties are required to follow the guidelines set forth in the DHCS Policy Manual. Key mandates include:\n- **Must:** Allocate 35% of funds for FSP programs (Policy Manual Section 7.B.1).\n- **Must:** Provide individualized, team-based care that is trauma-informed and recovery-focused (Policy Manual Section 7.B.2).\n- **Should:** Establish levels of care based on acuity to ensure appropriate service availability (Policy Manual Section 7.B.4).\n- **Should:** Use BHSS funds for Outreach and Engagement activities to connect with individuals and families (Policy Manual Section 7.A.3).\n\n### Action Items for County\n1. Allocate 35% of the Behavioral Health Services Fund specifically for FSP programs and document this allocation (by the end of the current fiscal year).\n2. Develop and implement individualized care plans that adhere to the \"whatever it takes\" approach, ensuring regular reviews (ongoing).\n3. Establish a tracking system for levels of care based on acuity to ensure appropriate service delivery (by June 2024).\n4. Incorporate evidence-based practices into service delivery to enhance engagement and reduce disparities (by December 2024).\n\n### Open Questions / Ambiguities\n- Clarification is needed on the specific metrics or criteria for determining acuity levels in FSP programs.\n- Further guidance on integrating SUD-only FSPs with existing BHSS services is required.",
  "final_response": "\u2705 **Good Quality** (Score: 8.6/10)\n\n## Compliance Summary\n\n### Bottom Line\nCounties must allocate 35% of their Behavioral Health Services Fund for Full Service Partnership (FSP) programs and ensure all providers meet the required standards for BHSA funding.\n\n### Statutory Basis\nNo specific statutory requirement identified.\n\n### Policy Guidance\nCounties are required to follow the guidelines set forth in the DHCS Policy Manual. Key mandates include:\n- **Must:** Allocate 35% of funds for FSP programs (Policy Manual Section 7.B.1).\n- **Must:** Provide individualized, team-based care that is trauma-informed and recovery-focused (Policy Manual Section 7.B.2).\n- **Should:** Establish levels of care based on acuity to ensure appropriate service availability (Policy Manual Section 7.B.4).\n- **Should:** Use BHSS funds for Outreach and Engagement activities to connect with individuals and families (Policy Manual Section 7.A.3).\n\n### Action Items for County\n1. Allocate 35% of the Behavioral Health Services Fund specifically for FSP programs and document this allocation (by the end of the current fiscal year).\n2. Develop and implement individualized care plans that adhere to the \"whatever it takes\" approach, ensuring regular reviews (ongoing).\n3. Establish a tracking system for levels of care based on acuity to ensure appropriate service delivery (by June 2024).\n4. Incorporate evidence-based practices into service delivery to enhance engagement and reduce disparities (by December 2024).\n\n### Open Questions / Ambiguities\n- Clarification is needed on the specific metrics or criteria for determining acuity levels in FSP programs.\n- Further guidance on integrating SUD-only FSPs with existing BHSS services is required.\n\n---\n\n**Processing Metadata:**\n- Priority: High\n- Statute Confidence: Low\n- Policy Confidence: Low\n- Relevant Statutes: None identified\n- Revision Count: 0\n\n**Quality Issues Noted:**\n- Missing specific statutory requirements could lead to confusion about compliance obligations.\n- Action item 2 lacks a specific timeline for implementation.",
  "action_items": [
    "Allocate 35% of the Behavioral Health Services Fund specifically for FSP programs and document this allocation (by the end of the current fiscal year).",
    "Develop and implement individualized care plans that adhere to the \"whatever it takes\" approach, ensuring regular reviews (ongoing).",
    "Establish a tracking system for levels of care based on acuity to ensure appropriate service delivery (by June 2024).",
    "Incorporate evidence-based practices into service delivery to enhance engagement and reduce disparities (by December 2024)."
  ],
  "priority": "High",
  "quality_score": 8.6,
  "passes_review": true,
  "metadata": {
    "statute_confidence": "Low",
    "policy_confidence": "Low",
    "relevant_statutes": [],
    "revision_count": 0,
    "quality_issues": [
      "Missing specific statutory requirements could lead to confusion about compliance obligations.",
      "Action item 2 lacks a specific timeline for implementation."
    ],
    "quality_suggestions": [
      "Consider including any relevant statutes or clarifying that none were found to strengthen the statutory basis section.",
      "Add a specific deadline for action item 2 to enhance clarity and accountability."
    ],
    "statute_chunks_retrieved": 10,
    "policy_chunks_retrieved": 10
  }
}