{
  "success": true,
  "final_summary": "## Compliance Summary\n\n### Bottom Line\nCounties must provide mental health services, supportive services, and substance use disorder treatment services as part of the BHSS funded Adult and Older Adult System of Care. Document the specific services offered under each program type.\n\n### Statutory Basis\nW&I Code \u00a7 5899 mandates counties to provide a range of services under the BHSS program, including mental health, supportive, and substance use disorder services. W&I Code \u00a7 5891 and \u00a7 5840 reinforce the requirement for a comprehensive system of care that includes these service types.\n\n### Policy Guidance\nAccording to the DHCS Policy Manual:\n- Counties **must** provide coordinated care based on individual needs (Policy Manual Section 7).\n- Counties **must** document the service types provided under the BHSS program.\n- Counties **should** consider integrating evidence-based practices in service delivery (Policy Manual Section 7.4).\n\n### Action Items for County\n1. Identify and document all service types provided under the BHSS funded Adult and Older Adult System of Care (by January 2024).\n2. Ensure that all services align with required levels of care based on individual acuity and needs (ongoing).\n3. Review and update provider qualifications to meet standards of care for each service type (by March 2024).\n4. Implement outreach and engagement activities to identify and connect individuals to available services (by February 2024).\n5. Maintain ongoing documentation of service types and compliance with standards (ongoing).\n\n### Open Questions / Ambiguities\n- Clarification is needed on criteria for determining service intensity needs for individuals transitioning between levels of care.\n- Further guidance may be required on the integration of SUD-only FSPs within the BHSS framework.",
  "final_response": "\u2705 **Good Quality** (Score: 8.8/10)\n\n## Compliance Summary\n\n### Bottom Line\nCounties must provide mental health services, supportive services, and substance use disorder treatment services as part of the BHSS funded Adult and Older Adult System of Care. Document the specific services offered under each program type.\n\n### Statutory Basis\nW&I Code \u00a7 5899 mandates counties to provide a range of services under the BHSS program, including mental health, supportive, and substance use disorder services. W&I Code \u00a7 5891 and \u00a7 5840 reinforce the requirement for a comprehensive system of care that includes these service types.\n\n### Policy Guidance\nAccording to the DHCS Policy Manual:\n- Counties **must** provide coordinated care based on individual needs (Policy Manual Section 7).\n- Counties **must** document the service types provided under the BHSS program.\n- Counties **should** consider integrating evidence-based practices in service delivery (Policy Manual Section 7.4).\n\n### Action Items for County\n1. Identify and document all service types provided under the BHSS funded Adult and Older Adult System of Care (by January 2024).\n2. Ensure that all services align with required levels of care based on individual acuity and needs (ongoing).\n3. Review and update provider qualifications to meet standards of care for each service type (by March 2024).\n4. Implement outreach and engagement activities to identify and connect individuals to available services (by February 2024).\n5. Maintain ongoing documentation of service types and compliance with standards (ongoing).\n\n### Open Questions / Ambiguities\n- Clarification is needed on criteria for determining service intensity needs for individuals transitioning between levels of care.\n- Further guidance may be required on the integration of SUD-only FSPs within the BHSS framework.\n\n---\n\n**Processing Metadata:**\n- Priority: High\n- Statute Confidence: Low\n- Policy Confidence: Low\n- Relevant Statutes: W&I Code \u00a7 5830, W&I Code \u00a7 5840, W&I Code \u00a7 5891, W&I Code \u00a7 5899\n- Revision Count: 0\n\n**Quality Issues Noted:**\n- The action items could benefit from more specific responsibilities assigned to individuals or teams.\n- The open questions section could be expanded for clarity.",
  "action_items": [
    "Identify and document all service types provided under the BHSS funded Adult and Older Adult System of Care (by January 2024).",
    "Ensure that all services align with required levels of care based on individual acuity and needs (ongoing).",
    "Review and update provider qualifications to meet standards of care for each service type (by March 2024).",
    "Implement outreach and engagement activities to identify and connect individuals to available services (by February 2024).",
    "Maintain ongoing documentation of service types and compliance with standards (ongoing)."
  ],
  "priority": "High",
  "quality_score": 8.8,
  "passes_review": true,
  "metadata": {
    "statute_confidence": "Low",
    "policy_confidence": "Low",
    "relevant_statutes": [
      "W&I Code \u00a7 5830",
      "W&I Code \u00a7 5840",
      "W&I Code \u00a7 5891",
      "W&I Code \u00a7 5899"
    ],
    "revision_count": 0,
    "quality_issues": [
      "The action items could benefit from more specific responsibilities assigned to individuals or teams.",
      "The open questions section could be expanded for clarity."
    ],
    "quality_suggestions": [
      "Assign specific individuals or teams to each action item for accountability.",
      "Provide more detail in the open questions section to clarify the nature of the ambiguities."
    ],
    "statute_chunks_retrieved": 10,
    "policy_chunks_retrieved": 10
  }
}