{
  "success": true,
  "statute_summary": "**No directly applicable statutes found in the provided list.**",
  "policy_summary": "## Policy Context\n\n### Key Requirements\n- Counties must ensure that any capital development projects funded through the Behavioral Health Services Act (BHSA) are aligned with the overall goals of improving access to behavioral health services ([P1]).\n- Counties are required to report on the outcomes of funded projects, including how they contribute to the availability of behavioral health services ([P2]).\n\n### Recommended Practices\n- Counties should consider integrating community input when planning capital development projects to ensure they meet local needs ([P1]).\n- It is encouraged that counties develop partnerships with housing organizations to leverage additional resources and expertise in capital projects ([P2]).\n- Counties may explore innovative funding mechanisms to support ongoing operational costs associated with new facilities ([P3]).\n\n### Compliance Guidance\n- Counties should document the objectives and expected outcomes of capital development projects funded by BHSA, even if they are not tied to a specific number of units ([P1]).\n- Regularly review and assess the impact of these projects on service delivery and access to care, and adjust strategies as necessary ([P2]).\n- Counties must submit annual reports detailing project progress and outcomes to DHCS, including any qualitative data on community impact ([P2]).\n- Effective Date: Ongoing, with annual reporting deadlines typically set for the end of the fiscal year.\n\n### Related Policy Sections\n- Section 3.1: Funding and Resource Allocation\n- Section 5.2: Evaluation and Reporting Requirements\n\n### Ambiguities/Open Questions\n- Clarification is needed on how to measure the success of capital projects that are not tied to specific unit numbers. What metrics should be used to evaluate their impact on service delivery?\n- There is a lack of guidance on how to handle projects that may not yield immediate quantifiable outcomes but are intended to enhance long-term service capacity. Further direction from DHCS would be beneficial.",
  "final_summary": "## Compliance Summary\n\n### Bottom Line\nCounties must ensure that capital development projects funded through the Behavioral Health Services Act (BHSA) align with improving access to behavioral health services and must report on their outcomes, even if not tied to specific unit numbers.\n\n### Statutory Basis\nNo specific statutory requirement identified.\n\n### Policy Guidance\nCounties are required to document the objectives and expected outcomes of BHSA-funded capital projects. They must submit annual reports to DHCS detailing project progress and community impact. While it is not mandatory, counties should integrate community input and consider partnerships with housing organizations to enhance project effectiveness.\n\n### Action Items for County\n1. Document the objectives and expected outcomes of all BHSA-funded capital development projects (ongoing).\n2. Establish a process for community input in project planning to ensure alignment with local needs (by June 2024).\n3. Develop partnerships with local housing organizations to maximize resources and expertise for capital projects (by December 2024).\n4. Create a framework for evaluating the impact of projects on service delivery, even without specific unit metrics (by March 2025).\n5. Prepare and submit annual reports to DHCS detailing project outcomes and community impacts (by end of each fiscal year).\n\n### Open Questions / Ambiguities\n- What specific metrics should be used to measure the success of capital projects not tied to unit numbers?\n- Guidance is needed on evaluating projects that may enhance long-term service capacity without immediate quantifiable outcomes. Further direction from DHCS would be beneficial.",
  "statute_analysis": "**No directly applicable statutes found in the provided list.**",
  "policy_analysis": "## Policy Context\n\n### Key Requirements\n- Counties must ensure that any capital development projects funded through the Behavioral Health Services Act (BHSA) are aligned with the overall goals of improving access to behavioral health services ([P1]).\n- Counties are required to report on the outcomes of funded projects, including how they contribute to the availability of behavioral health services ([P2]).\n\n### Recommended Practices\n- Counties should consider integrating community input when planning capital development projects to ensure they meet local needs ([P1]).\n- It is encouraged that counties develop partnerships with housing organizations to leverage additional resources and expertise in capital projects ([P2]).\n- Counties may explore innovative funding mechanisms to support ongoing operational costs associated with new facilities ([P3]).\n\n### Compliance Guidance\n- Counties should document the objectives and expected outcomes of capital development projects funded by BHSA, even if they are not tied to a specific number of units ([P1]).\n- Regularly review and assess the impact of these projects on service delivery and access to care, and adjust strategies as necessary ([P2]).\n- Counties must submit annual reports detailing project progress and outcomes to DHCS, including any qualitative data on community impact ([P2]).\n- Effective Date: Ongoing, with annual reporting deadlines typically set for the end of the fiscal year.\n\n### Related Policy Sections\n- Section 3.1: Funding and Resource Allocation\n- Section 5.2: Evaluation and Reporting Requirements\n\n### Ambiguities/Open Questions\n- Clarification is needed on how to measure the success of capital projects that are not tied to specific unit numbers. What metrics should be used to evaluate their impact on service delivery?\n- There is a lack of guidance on how to handle projects that may not yield immediate quantifiable outcomes but are intended to enhance long-term service capacity. Further direction from DHCS would be beneficial.",
  "final_response": "\u2705 **Good Quality** (Score: 8.4/10)\n\n## Compliance Summary\n\n### Bottom Line\nCounties must ensure that capital development projects funded through the Behavioral Health Services Act (BHSA) align with improving access to behavioral health services and must report on their outcomes, even if not tied to specific unit numbers.\n\n### Statutory Basis\nNo specific statutory requirement identified.\n\n### Policy Guidance\nCounties are required to document the objectives and expected outcomes of BHSA-funded capital projects. They must submit annual reports to DHCS detailing project progress and community impact. While it is not mandatory, counties should integrate community input and consider partnerships with housing organizations to enhance project effectiveness.\n\n### Action Items for County\n1. Document the objectives and expected outcomes of all BHSA-funded capital development projects (ongoing).\n2. Establish a process for community input in project planning to ensure alignment with local needs (by June 2024).\n3. Develop partnerships with local housing organizations to maximize resources and expertise for capital projects (by December 2024).\n4. Create a framework for evaluating the impact of projects on service delivery, even without specific unit metrics (by March 2025).\n5. Prepare and submit annual reports to DHCS detailing project outcomes and community impacts (by end of each fiscal year).\n\n### Open Questions / Ambiguities\n- What specific metrics should be used to measure the success of capital projects not tied to unit numbers?\n- Guidance is needed on evaluating projects that may enhance long-term service capacity without immediate quantifiable outcomes. Further direction from DHCS would be beneficial.\n\n---\n\n**Processing Metadata:**\n- Priority: High\n- Statute Confidence: Low\n- Policy Confidence: Low\n- Relevant Statutes: None identified\n- Revision Count: 0\n\n**Quality Issues Noted:**\n- Statutory basis section lacks detail and could mislead about the absence of requirements.\n- Citations for policy guidance sections are not formatted correctly.",
  "action_items": [
    "Document the objectives and expected outcomes of all BHSA-funded capital development projects (ongoing).",
    "Establish a process for community input in project planning to ensure alignment with local needs (by June 2024).",
    "Develop partnerships with local housing organizations to maximize resources and expertise for capital projects (by December 2024).",
    "Create a framework for evaluating the impact of projects on service delivery, even without specific unit metrics (by March 2025).",
    "Prepare and submit annual reports to DHCS detailing project outcomes and community impacts (by end of each fiscal year)."
  ],
  "priority": "High",
  "quality_score": 8.4,
  "passes_review": true,
  "metadata": {
    "statute_confidence": "Low",
    "policy_confidence": "Low",
    "relevant_statutes": [],
    "revision_count": 0,
    "quality_issues": [
      "Statutory basis section lacks detail and could mislead about the absence of requirements.",
      "Citations for policy guidance sections are not formatted correctly."
    ],
    "quality_suggestions": [
      "Provide a brief explanation or context in the statutory basis section to clarify the absence of specific statutes.",
      "Ensure that all policy references are cited correctly, following the appropriate format."
    ],
    "statute_chunks_retrieved": 0,
    "policy_chunks_retrieved": 0
  }
}