{
  "success": true,
  "statute_summary": "**No directly applicable statutes found in the provided list.**",
  "policy_summary": "## Policy Context\n\n### Key Requirements\n- No mandatory requirements identified due to lack of retrieved policy documents.\n\n### Recommended Practices\n- Counties are encouraged to utilize data sources such as workforce surveys, internal HR reports, and industry benchmarks to assess vacancy rates.\n- It is recommended that counties maintain transparency by documenting the methodologies used to determine vacancy rates.\n\n### Compliance Guidance\n- Counties should compile and upload any relevant data sources used to determine vacancy rates, even though this is optional. This may include:\n  - Internal HR data on current staffing levels and open positions.\n  - External labor market analyses or reports from professional associations.\n  - Surveys conducted within the county to assess workforce availability.\n- Ensure that any uploaded data sources are clearly labeled and include a brief description of their relevance to the vacancy rate assessment.\n\n### Related Policy Sections\n- No related policy sections identified due to lack of retrieved documents.\n\n### Ambiguities/Open Questions\n- Clarification is needed on whether there are specific formats or templates preferred for data uploads.\n- The implications of not uploading data sources, given that it is optional, should be clarified\u2014will it affect compliance evaluations or funding?",
  "final_summary": "## Compliance Summary\n\n### Bottom Line\nCounties are encouraged to compile and upload any data sources used to determine vacancy rates, although this is optional.\n\n### Statutory Basis\nNo specific statutory requirement identified.\n\n### Policy Guidance\nWhile there are no mandatory requirements, counties should consider using various data sources to assess vacancy rates. Recommended practices include:\n- Utilizing workforce surveys, internal HR reports, and industry benchmarks.\n- Maintaining transparency by documenting methodologies used for determining vacancy rates.\n\n### Action Items for County\n1. Gather relevant data sources used to assess vacancy rates, such as HR data on staffing levels and external labor market reports (by March 2024).\n2. Clearly label and describe the relevance of each data source before uploading to ensure clarity.\n3. Document the methodology used for determining vacancy rates to maintain transparency.\n4. Review and assess the potential impact of not uploading data sources on compliance evaluations or funding.\n\n### Open Questions / Ambiguities\n- Clarification is needed on preferred formats or templates for data uploads.\n- What are the implications of not uploading data sources, considering it is optional? Will it affect compliance evaluations or funding?",
  "statute_analysis": "**No directly applicable statutes found in the provided list.**",
  "policy_analysis": "## Policy Context\n\n### Key Requirements\n- No mandatory requirements identified due to lack of retrieved policy documents.\n\n### Recommended Practices\n- Counties are encouraged to utilize data sources such as workforce surveys, internal HR reports, and industry benchmarks to assess vacancy rates.\n- It is recommended that counties maintain transparency by documenting the methodologies used to determine vacancy rates.\n\n### Compliance Guidance\n- Counties should compile and upload any relevant data sources used to determine vacancy rates, even though this is optional. This may include:\n  - Internal HR data on current staffing levels and open positions.\n  - External labor market analyses or reports from professional associations.\n  - Surveys conducted within the county to assess workforce availability.\n- Ensure that any uploaded data sources are clearly labeled and include a brief description of their relevance to the vacancy rate assessment.\n\n### Related Policy Sections\n- No related policy sections identified due to lack of retrieved documents.\n\n### Ambiguities/Open Questions\n- Clarification is needed on whether there are specific formats or templates preferred for data uploads.\n- The implications of not uploading data sources, given that it is optional, should be clarified\u2014will it affect compliance evaluations or funding?",
  "final_response": "\u2705 **Good Quality** (Score: 8.4/10)\n\n## Compliance Summary\n\n### Bottom Line\nCounties are encouraged to compile and upload any data sources used to determine vacancy rates, although this is optional.\n\n### Statutory Basis\nNo specific statutory requirement identified.\n\n### Policy Guidance\nWhile there are no mandatory requirements, counties should consider using various data sources to assess vacancy rates. Recommended practices include:\n- Utilizing workforce surveys, internal HR reports, and industry benchmarks.\n- Maintaining transparency by documenting methodologies used for determining vacancy rates.\n\n### Action Items for County\n1. Gather relevant data sources used to assess vacancy rates, such as HR data on staffing levels and external labor market reports (by March 2024).\n2. Clearly label and describe the relevance of each data source before uploading to ensure clarity.\n3. Document the methodology used for determining vacancy rates to maintain transparency.\n4. Review and assess the potential impact of not uploading data sources on compliance evaluations or funding.\n\n### Open Questions / Ambiguities\n- Clarification is needed on preferred formats or templates for data uploads.\n- What are the implications of not uploading data sources, considering it is optional? Will it affect compliance evaluations or funding?\n\n---\n\n**Processing Metadata:**\n- Priority: Medium\n- Statute Confidence: Low\n- Policy Confidence: Low\n- Relevant Statutes: None identified\n- Revision Count: 0\n\n**Quality Issues Noted:**\n- Missing specific citations for recommended practices and methodologies\n- Action item 4 lacks a clear timeline",
  "action_items": [
    "Gather relevant data sources used to assess vacancy rates, such as HR data on staffing levels and external labor market reports (by March 2024).",
    "Clearly label and describe the relevance of each data source before uploading to ensure clarity.",
    "Document the methodology used for determining vacancy rates to maintain transparency.",
    "Review and assess the potential impact of not uploading data sources on compliance evaluations or funding."
  ],
  "priority": "Medium",
  "quality_score": 8.4,
  "passes_review": true,
  "metadata": {
    "statute_confidence": "Low",
    "policy_confidence": "Low",
    "relevant_statutes": [],
    "revision_count": 0,
    "quality_issues": [
      "Missing specific citations for recommended practices and methodologies",
      "Action item 4 lacks a clear timeline"
    ],
    "quality_suggestions": [
      "Include specific citations for the recommended practices and methodologies mentioned",
      "Add a timeline to action item 4 to enhance clarity and accountability"
    ],
    "statute_chunks_retrieved": 0,
    "policy_chunks_retrieved": 0
  }
}