{
  "success": true,
  "statute_summary": "**Relevant Statutes:**\n\n1. **Statute Citation:** W&I Code \u00a7 5899 (Source: [S1])\n   **Relevance:** This statute outlines the funding mechanisms for the Behavioral Health Services Act, which may include various funding sources beyond the Behavioral Health Services Account (BHSA).\n   **Key Requirement:** The county may utilize funds from other sources to supplement the BHSA, provided that these funds are used in accordance with the requirements of the Behavioral Health Services Act.\n\n2. **Statute Citation:** W&I Code \u00a7 5892 (Source: [S1])\n   **Relevance:** This statute specifies the allocation of funds for mental health services, indicating that counties can receive funding from multiple sources to support their programs.\n   **Key Requirement:** Counties must ensure that any additional funding sources align with the objectives of the mental health services provided under the Behavioral Health Services Act.\n\n3. **Statute Citation:** W&I Code \u00a7 5840 (Source: [S1])\n   **Relevance:** This statute discusses the responsibilities of counties in managing mental health services, including the potential for leveraging various funding sources.\n   **Key Requirement:** Counties are required to report on the use of funds, including any non-BHSA funding sources, to ensure transparency and compliance with state regulations.\n\n**No directly applicable statutes found in the provided list.**",
  "policy_summary": "## Policy Context\n\n### Key Requirements\n- Counties must identify all funding sources utilized for the Community Support Collaborative (CSC) program, including any non-Behavioral Health Services Act (BHSA) funding ([P1]).\n- Counties are required to provide a narrative detailing the additional funding sources if applicable ([P1]).\n\n### Recommended Practices\n- Counties should consider leveraging multiple funding sources to enhance the sustainability and reach of the CSC program ([P1]).\n- It is encouraged for counties to engage stakeholders in identifying potential non-BHSA funding opportunities ([P1]).\n\n### Compliance Guidance\n- Counties should complete the funding source identification by filling out the designated form, ensuring that all funding sources are accurately reported ([P1]).\n- If the answer to the funding source question is \"Yes,\" counties must provide a detailed narrative in the specified box, listing each additional funding source and its intended use within the CSC program ([P1]).\n- Counties should establish a timeline for reviewing and updating funding sources annually to ensure ongoing compliance and program effectiveness ([P1]).\n\n### Related Policy Sections\n- No additional policy sections referenced in the retrieved documents.\n\n### Ambiguities/Open Questions\n- Clarification is needed on whether there are specific criteria for what constitutes an acceptable non-BHSA funding source.\n- Further guidance may be required on how to report the impact of these additional funding sources on the CSC program's effectiveness and outcomes.",
  "final_summary": "## Compliance Summary\n\n### Bottom Line\nCounties must identify all funding sources for the Community Support Collaborative (CSC) program, including any non-BHSA funding, and provide a narrative detailing these sources if applicable.\n\n### Statutory Basis\nW&I Code \u00a7 5899 allows counties to use various funding sources to supplement BHSA, provided they comply with the Behavioral Health Services Act. W&I Code \u00a7 5892 emphasizes that counties can receive multiple funding sources for mental health services. W&I Code \u00a7 5840 mandates counties to report on all funding sources used, ensuring transparency.\n\n### Policy Guidance\nCounties \"must\" identify all funding sources for the CSC program and provide a narrative if additional sources are used. It is \"recommended\" that counties leverage multiple funding sources for sustainability and engage stakeholders in identifying opportunities. Counties should also establish an annual review timeline for funding sources to maintain compliance.\n\n### Action Items for County\n1. Complete the funding source identification form for the CSC program, including any non-BHSA sources (by [insert date]).\n2. If applicable, provide a detailed narrative listing each additional funding source and its intended use within the CSC program (by [insert date]).\n3. Engage stakeholders to explore potential non-BHSA funding opportunities (ongoing).\n4. Establish a timeline for annual review and updates of funding sources to ensure compliance and program effectiveness (by [insert date]).\n\n### Open Questions / Ambiguities\n- What specific criteria define an acceptable non-BHSA funding source?\n- What guidance exists for reporting the impact of additional funding sources on the CSC program's effectiveness?",
  "statute_analysis": "**Relevant Statutes:**\n\n1. **Statute Citation:** W&I Code \u00a7 5899 (Source: [S1])\n   **Relevance:** This statute outlines the funding mechanisms for the Behavioral Health Services Act, which may include various funding sources beyond the Behavioral Health Services Account (BHSA).\n   **Key Requirement:** The county may utilize funds from other sources to supplement the BHSA, provided that these funds are used in accordance with the requirements of the Behavioral Health Services Act.\n\n2. **Statute Citation:** W&I Code \u00a7 5892 (Source: [S1])\n   **Relevance:** This statute specifies the allocation of funds for mental health services, indicating that counties can receive funding from multiple sources to support their programs.\n   **Key Requirement:** Counties must ensure that any additional funding sources align with the objectives of the mental health services provided under the Behavioral Health Services Act.\n\n3. **Statute Citation:** W&I Code \u00a7 5840 (Source: [S1])\n   **Relevance:** This statute discusses the responsibilities of counties in managing mental health services, including the potential for leveraging various funding sources.\n   **Key Requirement:** Counties are required to report on the use of funds, including any non-BHSA funding sources, to ensure transparency and compliance with state regulations.\n\n**No directly applicable statutes found in the provided list.**",
  "policy_analysis": "## Policy Context\n\n### Key Requirements\n- Counties must identify all funding sources utilized for the Community Support Collaborative (CSC) program, including any non-Behavioral Health Services Act (BHSA) funding ([P1]).\n- Counties are required to provide a narrative detailing the additional funding sources if applicable ([P1]).\n\n### Recommended Practices\n- Counties should consider leveraging multiple funding sources to enhance the sustainability and reach of the CSC program ([P1]).\n- It is encouraged for counties to engage stakeholders in identifying potential non-BHSA funding opportunities ([P1]).\n\n### Compliance Guidance\n- Counties should complete the funding source identification by filling out the designated form, ensuring that all funding sources are accurately reported ([P1]).\n- If the answer to the funding source question is \"Yes,\" counties must provide a detailed narrative in the specified box, listing each additional funding source and its intended use within the CSC program ([P1]).\n- Counties should establish a timeline for reviewing and updating funding sources annually to ensure ongoing compliance and program effectiveness ([P1]).\n\n### Related Policy Sections\n- No additional policy sections referenced in the retrieved documents.\n\n### Ambiguities/Open Questions\n- Clarification is needed on whether there are specific criteria for what constitutes an acceptable non-BHSA funding source.\n- Further guidance may be required on how to report the impact of these additional funding sources on the CSC program's effectiveness and outcomes.",
  "final_response": "\u2705 **Good Quality** (Score: 8.4/10)\n\n## Compliance Summary\n\n### Bottom Line\nCounties must identify all funding sources for the Community Support Collaborative (CSC) program, including any non-BHSA funding, and provide a narrative detailing these sources if applicable.\n\n### Statutory Basis\nW&I Code \u00a7 5899 allows counties to use various funding sources to supplement BHSA, provided they comply with the Behavioral Health Services Act. W&I Code \u00a7 5892 emphasizes that counties can receive multiple funding sources for mental health services. W&I Code \u00a7 5840 mandates counties to report on all funding sources used, ensuring transparency.\n\n### Policy Guidance\nCounties \"must\" identify all funding sources for the CSC program and provide a narrative if additional sources are used. It is \"recommended\" that counties leverage multiple funding sources for sustainability and engage stakeholders in identifying opportunities. Counties should also establish an annual review timeline for funding sources to maintain compliance.\n\n### Action Items for County\n1. Complete the funding source identification form for the CSC program, including any non-BHSA sources (by [insert date]).\n2. If applicable, provide a detailed narrative listing each additional funding source and its intended use within the CSC program (by [insert date]).\n3. Engage stakeholders to explore potential non-BHSA funding opportunities (ongoing).\n4. Establish a timeline for annual review and updates of funding sources to ensure compliance and program effectiveness (by [insert date]).\n\n### Open Questions / Ambiguities\n- What specific criteria define an acceptable non-BHSA funding source?\n- What guidance exists for reporting the impact of additional funding sources on the CSC program's effectiveness?\n\n---\n\n**Processing Metadata:**\n- Priority: High\n- Statute Confidence: Low\n- Policy Confidence: Low\n- Relevant Statutes: W&I Code \u00a7 5840, W&I Code \u00a7 5892, W&I Code \u00a7 5899\n- Revision Count: 0\n\n**Quality Issues Noted:**\n- Missing specific deadlines in action items.\n- Action item 2 lacks clarity on the narrative format required.",
  "action_items": [
    "Complete the funding source identification form for the CSC program, including any non-BHSA sources (by [insert date]).",
    "If applicable, provide a detailed narrative listing each additional funding source and its intended use within the CSC program (by [insert date]).",
    "Engage stakeholders to explore potential non-BHSA funding opportunities (ongoing).",
    "Establish a timeline for annual review and updates of funding sources to ensure compliance and program effectiveness (by [insert date])."
  ],
  "priority": "High",
  "quality_score": 8.4,
  "passes_review": true,
  "metadata": {
    "statute_confidence": "Low",
    "policy_confidence": "Low",
    "relevant_statutes": [
      "W&I Code \u00a7 5840",
      "W&I Code \u00a7 5892",
      "W&I Code \u00a7 5899"
    ],
    "revision_count": 0,
    "quality_issues": [
      "Missing specific deadlines in action items.",
      "Action item 2 lacks clarity on the narrative format required."
    ],
    "quality_suggestions": [
      "Insert specific dates for all action items to enhance accountability.",
      "Clarify the format and details expected in the narrative for action item 2."
    ],
    "statute_chunks_retrieved": 0,
    "policy_chunks_retrieved": 0
  }
}