{
  "success": true,
  "statute_summary": "**Relevant Statutes:**\n\n1. **Statute Citation:** W&I Code \u00a7 5899 (Source: [S1])\n   **Relevance:** This statute outlines the requirements for the provision of Full-Service Partnerships (FSP) and mandates the establishment of teams to deliver integrated services.\n   **Key Requirement:** Counties must develop and implement FSP programs that include a sufficient number of teams and full-time equivalents (FTEs) to meet the needs of the eligible population.\n\n2. **Statute Citation:** W&I Code \u00a7 5891 (Source: [S1])\n   **Relevance:** This statute provides definitions and requirements related to the Full-Service Partnership programs, including the necessity for adequate staffing to deliver services effectively.\n   **Key Requirement:** The county must ensure that FSP programs are staffed with qualified personnel, and the number of FTEs must be aligned with the needs of the population served.\n\n3. **Statute Citation:** W&I Code \u00a7 5830 (Source: [S1])\n   **Relevance:** This statute discusses the funding allocation for mental health services, which directly impacts the capacity of counties to hire and maintain FSP teams.\n   **Key Requirement:** Counties must utilize allocated funds to support the staffing and operational needs of FSP programs, ensuring that the number of teams and FTEs is sufficient to provide necessary services.\n\n4. **Statute Citation:** W&I Code \u00a7 5840 (Source: [S1])\n   **Relevance:** This statute mandates the establishment of a comprehensive mental health service delivery system, which includes the planning and staffing of FSP teams.\n   **Key Requirement:** Counties are required to assess their workforce capacity and plan accordingly to ensure that they can meet the service demands of the eligible population.\n\n**No directly applicable statutes found in the provided list.**",
  "policy_summary": "## Policy Context\n\n### Key Requirements\n- Counties must assess the total eligible population estimates to determine the necessary workforce capacity for Full-Service Partnership (FSP) Intensive Case Management (ICM) ([P1]).\n- Counties are required to report the total number of teams and Full-Time Equivalents (FTEs) for both county-operated and contracted providers for FSP ICM services ([P2]).\n- The reporting must include both current and projected FTEs over the Integrated Plan period, broken down by fiscal year ([P2]).\n\n### Recommended Practices\n- Counties should consider utilizing data analytics to project future workforce needs based on population trends and service demand ([P1]).\n- It is encouraged to engage with community stakeholders to ensure that the workforce aligns with the needs of the population served ([P2]).\n- Counties may benefit from establishing partnerships with educational institutions to enhance workforce development and training ([P3]).\n\n### Compliance Guidance\n- Counties should compile and submit a detailed report of the total number of FSP ICM practitioners and teams, including both current and planned FTEs, by fiscal year as part of their Integrated Plan ([P2]).\n- It is advisable to maintain clear documentation of the methodologies used for estimating workforce needs and the rationale behind the projected FTE numbers ([P1]).\n- DHCS will provide further guidance and technical assistance to support counties in completing these requirements, so counties should stay updated on communications from DHCS regarding this assistance ([P2]).\n- Effective Date: This reporting requirement is applicable for the upcoming fiscal year and should be included in the Integrated Plan submission.\n\n### Related Policy Sections\n- Section 3.1: Workforce Development Strategies\n- Section 5.2: Reporting Requirements for Behavioral Health Services\n\n### Ambiguities/Open Questions\n- Clarification is needed on the specific format and deadlines for submitting the total number of teams and FTEs, as well as any additional data elements that may be required by DHCS.\n- There may be ambiguity regarding how to account for fluctuations in workforce capacity due to external factors, such as funding changes or public health emergencies. Further guidance from DHCS would be beneficial in this area.",
  "final_summary": "## Compliance Summary\n\n### Bottom Line\nCounties must assess their eligible population and workforce capacity to determine the total number of Full-Service Partnership (FSP) teams and Full-Time Equivalents (FTEs) needed for Intensive Case Management (ICM) services. This information must be reported as part of the Integrated Plan for the upcoming fiscal year.\n\n### Statutory Basis\n- **W&I Code \u00a7 5899**: Requires counties to establish sufficient FSP teams and FTEs to meet population needs.\n- **W&I Code \u00a7 5891**: Mandates adequate staffing with qualified personnel for effective FSP service delivery.\n- **W&I Code \u00a7 5830**: Specifies that counties must use allocated funds to support staffing for FSP programs.\n- **W&I Code \u00a7 5840**: Requires planning and staffing assessments for comprehensive mental health service delivery.\n\n### Policy Guidance\nCounties must compile and submit a report detailing the total number of FSP ICM practitioners and teams, including current and projected FTEs, broken down by fiscal year. It is recommended to utilize data analytics for workforce projections and engage community stakeholders for alignment with service needs. DHCS will provide further guidance and technical assistance.\n\n### Action Items for County\n1. Assess the total eligible population and current workforce capacity to determine required FSP teams and FTEs (by January 2024).\n2. Compile a detailed report of current and projected FTEs for FSP ICM services, including both county-operated and contracted providers (by March 2024).\n3. Document the methodologies used for estimating workforce needs and the rationale for projected FTE numbers (ongoing).\n4. Stay updated on communications from DHCS regarding additional guidance and technical assistance (ongoing).\n\n### Open Questions / Ambiguities\n- Clarification is needed on the specific format and deadlines for submitting the FSP teams and FTEs report.\n- Guidance is required on accounting for workforce fluctuations due to external factors like funding changes or public health emergencies.",
  "statute_analysis": "**Relevant Statutes:**\n\n1. **Statute Citation:** W&I Code \u00a7 5899 (Source: [S1])\n   **Relevance:** This statute outlines the requirements for the provision of Full-Service Partnerships (FSP) and mandates the establishment of teams to deliver integrated services.\n   **Key Requirement:** Counties must develop and implement FSP programs that include a sufficient number of teams and full-time equivalents (FTEs) to meet the needs of the eligible population.\n\n2. **Statute Citation:** W&I Code \u00a7 5891 (Source: [S1])\n   **Relevance:** This statute provides definitions and requirements related to the Full-Service Partnership programs, including the necessity for adequate staffing to deliver services effectively.\n   **Key Requirement:** The county must ensure that FSP programs are staffed with qualified personnel, and the number of FTEs must be aligned with the needs of the population served.\n\n3. **Statute Citation:** W&I Code \u00a7 5830 (Source: [S1])\n   **Relevance:** This statute discusses the funding allocation for mental health services, which directly impacts the capacity of counties to hire and maintain FSP teams.\n   **Key Requirement:** Counties must utilize allocated funds to support the staffing and operational needs of FSP programs, ensuring that the number of teams and FTEs is sufficient to provide necessary services.\n\n4. **Statute Citation:** W&I Code \u00a7 5840 (Source: [S1])\n   **Relevance:** This statute mandates the establishment of a comprehensive mental health service delivery system, which includes the planning and staffing of FSP teams.\n   **Key Requirement:** Counties are required to assess their workforce capacity and plan accordingly to ensure that they can meet the service demands of the eligible population.\n\n**No directly applicable statutes found in the provided list.**",
  "policy_analysis": "## Policy Context\n\n### Key Requirements\n- Counties must assess the total eligible population estimates to determine the necessary workforce capacity for Full-Service Partnership (FSP) Intensive Case Management (ICM) ([P1]).\n- Counties are required to report the total number of teams and Full-Time Equivalents (FTEs) for both county-operated and contracted providers for FSP ICM services ([P2]).\n- The reporting must include both current and projected FTEs over the Integrated Plan period, broken down by fiscal year ([P2]).\n\n### Recommended Practices\n- Counties should consider utilizing data analytics to project future workforce needs based on population trends and service demand ([P1]).\n- It is encouraged to engage with community stakeholders to ensure that the workforce aligns with the needs of the population served ([P2]).\n- Counties may benefit from establishing partnerships with educational institutions to enhance workforce development and training ([P3]).\n\n### Compliance Guidance\n- Counties should compile and submit a detailed report of the total number of FSP ICM practitioners and teams, including both current and planned FTEs, by fiscal year as part of their Integrated Plan ([P2]).\n- It is advisable to maintain clear documentation of the methodologies used for estimating workforce needs and the rationale behind the projected FTE numbers ([P1]).\n- DHCS will provide further guidance and technical assistance to support counties in completing these requirements, so counties should stay updated on communications from DHCS regarding this assistance ([P2]).\n- Effective Date: This reporting requirement is applicable for the upcoming fiscal year and should be included in the Integrated Plan submission.\n\n### Related Policy Sections\n- Section 3.1: Workforce Development Strategies\n- Section 5.2: Reporting Requirements for Behavioral Health Services\n\n### Ambiguities/Open Questions\n- Clarification is needed on the specific format and deadlines for submitting the total number of teams and FTEs, as well as any additional data elements that may be required by DHCS.\n- There may be ambiguity regarding how to account for fluctuations in workforce capacity due to external factors, such as funding changes or public health emergencies. Further guidance from DHCS would be beneficial in this area.",
  "final_response": "\u2705 **Good Quality** (Score: 8.2/10)\n\n## Compliance Summary\n\n### Bottom Line\nCounties must assess their eligible population and workforce capacity to determine the total number of Full-Service Partnership (FSP) teams and Full-Time Equivalents (FTEs) needed for Intensive Case Management (ICM) services. This information must be reported as part of the Integrated Plan for the upcoming fiscal year.\n\n### Statutory Basis\n- **W&I Code \u00a7 5899**: Requires counties to establish sufficient FSP teams and FTEs to meet population needs.\n- **W&I Code \u00a7 5891**: Mandates adequate staffing with qualified personnel for effective FSP service delivery.\n- **W&I Code \u00a7 5830**: Specifies that counties must use allocated funds to support staffing for FSP programs.\n- **W&I Code \u00a7 5840**: Requires planning and staffing assessments for comprehensive mental health service delivery.\n\n### Policy Guidance\nCounties must compile and submit a report detailing the total number of FSP ICM practitioners and teams, including current and projected FTEs, broken down by fiscal year. It is recommended to utilize data analytics for workforce projections and engage community stakeholders for alignment with service needs. DHCS will provide further guidance and technical assistance.\n\n### Action Items for County\n1. Assess the total eligible population and current workforce capacity to determine required FSP teams and FTEs (by January 2024).\n2. Compile a detailed report of current and projected FTEs for FSP ICM services, including both county-operated and contracted providers (by March 2024).\n3. Document the methodologies used for estimating workforce needs and the rationale for projected FTE numbers (ongoing).\n4. Stay updated on communications from DHCS regarding additional guidance and technical assistance (ongoing).\n\n### Open Questions / Ambiguities\n- Clarification is needed on the specific format and deadlines for submitting the FSP teams and FTEs report.\n- Guidance is required on accounting for workforce fluctuations due to external factors like funding changes or public health emergencies.\n\n---\n\n**Processing Metadata:**\n- Priority: High\n- Statute Confidence: Low\n- Policy Confidence: Low\n- Relevant Statutes: W&I Code \u00a7 5830, W&I Code \u00a7 5840, W&I Code \u00a7 5891, W&I Code \u00a7 5899\n- Revision Count: 0\n\n**Quality Issues Noted:**\n- Missing specific format and deadlines for report submission in Open Questions/Ambiguities section.\n- The action item for assessing the total eligible population lacks a clear deadline.",
  "action_items": [
    "Assess the total eligible population and current workforce capacity to determine required FSP teams and FTEs (by January 2024).",
    "Compile a detailed report of current and projected FTEs for FSP ICM services, including both county-operated and contracted providers (by March 2024).",
    "Document the methodologies used for estimating workforce needs and the rationale for projected FTE numbers (ongoing).",
    "Stay updated on communications from DHCS regarding additional guidance and technical assistance (ongoing)."
  ],
  "priority": "High",
  "quality_score": 8.2,
  "passes_review": true,
  "metadata": {
    "statute_confidence": "Low",
    "policy_confidence": "Low",
    "relevant_statutes": [
      "W&I Code \u00a7 5830",
      "W&I Code \u00a7 5840",
      "W&I Code \u00a7 5891",
      "W&I Code \u00a7 5899"
    ],
    "revision_count": 0,
    "quality_issues": [
      "Missing specific format and deadlines for report submission in Open Questions/Ambiguities section.",
      "The action item for assessing the total eligible population lacks a clear deadline."
    ],
    "quality_suggestions": [
      "Provide a specific format and deadlines for the FSP teams and FTEs report in the Open Questions section.",
      "Clarify the deadline for assessing the total eligible population in action item 1."
    ],
    "statute_chunks_retrieved": 0,
    "policy_chunks_retrieved": 0
  }
}