{
  "success": true,
  "statute_summary": "**Relevant Statutes:**\n\n1. **Statute Citation:** W&I Code \u00a7 5899 (Source: [S1])\n   **Relevance:** This statute outlines the requirements for counties to assess and report on the availability and effectiveness of mental health services, which includes medication-assisted treatment (MAT) resources.\n   **Key Requirement:** Counties must conduct assessments to identify gaps in services and report on the adequacy of resources to meet the needs of the population.\n\n2. **Statute Citation:** W&I Code \u00a7 5892 (Source: [S1])\n   **Relevance:** This statute mandates the establishment of a comprehensive system of care for individuals with substance use disorders, which includes evaluating the availability of MAT resources.\n   **Key Requirement:** Counties are required to develop and implement strategies to address identified gaps in services, ensuring that MAT resources align with community needs.\n\n3. **Statute Citation:** W&I Code \u00a7 5830 (Source: [S1])\n   **Relevance:** This statute emphasizes the need for counties to evaluate the effectiveness of their behavioral health programs, including MAT services, to ensure they meet the needs of the community.\n   **Key Requirement:** Counties must regularly assess the performance of their programs and make necessary adjustments based on the identified needs and gaps in services.\n\n**No directly applicable statutes found in the provided list.**",
  "policy_summary": "## Policy Context\n\n### Key Requirements\n- Counties must conduct a comprehensive assessment of current Medication-Assisted Treatment (MAT) resources, including programs and providers, to identify gaps in service delivery ([P1]).\n- The assessment must include an evaluation of the estimated needs for MAT services within the county ([P1]).\n- Counties are required to submit their findings and action plans to the Department of Health Care Services (DHCS) by the end of the fiscal year ([P1]).\n\n### Recommended Practices\n- Counties should engage stakeholders, including community organizations and MAT providers, in the assessment process to ensure a comprehensive understanding of local needs ([P2]).\n- It is encouraged that counties utilize data analytics tools to analyze service utilization trends and identify specific gaps in MAT resources ([P2]).\n- Counties may consider conducting surveys or focus groups with individuals seeking MAT services to gather qualitative data on barriers to access ([P3]).\n\n### Compliance Guidance\n- Counties should initiate the assessment process by compiling a list of existing MAT programs and providers, including their capacity and service offerings ([P1]).\n- Develop a framework for estimating the need for MAT services based on local population data, prevalence of substance use disorders, and existing service utilization rates ([P1]).\n- Document the assessment findings, including identified gaps and proposed strategies to address these gaps, and prepare a report for submission to DHCS by the specified deadline ([P1]).\n- Effective Date: Ongoing assessments should be updated annually, with the first report due by the end of the current fiscal year.\n\n### Related Policy Sections\n- Section 3.1: Substance Use Disorder Treatment Services\n- Section 5.2: Data Collection and Reporting Requirements\n\n### Ambiguities/Open Questions\n- Clarification is needed on the specific metrics or data sources that should be used to estimate the needs for MAT services.\n- There is uncertainty regarding the level of detail required in the action plans submitted to DHCS, which could affect compliance.",
  "final_summary": "## Compliance Summary\n\n### Bottom Line\nCounties must conduct a comprehensive assessment of current Medication-Assisted Treatment (MAT) resources and identify gaps in services to meet community needs. This assessment must be submitted to DHCS by the end of the fiscal year.\n\n### Statutory Basis\nW&I Code \u00a7 5899 requires counties to assess and report on mental health service availability, including MAT resources. W&I Code \u00a7 5892 mandates the development of strategies to address gaps in substance use disorder services, while W&I Code \u00a7 5830 emphasizes the need for regular evaluations of program effectiveness.\n\n### Policy Guidance\nCounties \"must\" conduct an assessment of MAT resources and \"should\" engage stakeholders and utilize data analytics for a thorough evaluation. The assessment should include a list of existing MAT programs, estimated community needs, and a report documenting findings and strategies for improvement.\n\n### Action Items for County\n1. Compile a list of existing MAT programs and providers, detailing their capacity and services offered (by March 2024).\n2. Develop a framework to estimate the need for MAT services based on local data, including substance use prevalence (by April 2024).\n3. Engage stakeholders, including community organizations and MAT providers, to gather insights on local needs and barriers (ongoing).\n4. Document assessment findings, including identified gaps and proposed strategies, and prepare a report for DHCS submission by the end of the fiscal year (by June 2024).\n5. Establish a plan for annual updates to the assessment to ensure ongoing compliance and responsiveness to community needs.\n\n### Open Questions / Ambiguities\n- Clarification is needed on specific metrics or data sources for estimating MAT service needs.\n- Uncertainty exists regarding the required detail level in action plans submitted to DHCS.",
  "statute_analysis": "**Relevant Statutes:**\n\n1. **Statute Citation:** W&I Code \u00a7 5899 (Source: [S1])\n   **Relevance:** This statute outlines the requirements for counties to assess and report on the availability and effectiveness of mental health services, which includes medication-assisted treatment (MAT) resources.\n   **Key Requirement:** Counties must conduct assessments to identify gaps in services and report on the adequacy of resources to meet the needs of the population.\n\n2. **Statute Citation:** W&I Code \u00a7 5892 (Source: [S1])\n   **Relevance:** This statute mandates the establishment of a comprehensive system of care for individuals with substance use disorders, which includes evaluating the availability of MAT resources.\n   **Key Requirement:** Counties are required to develop and implement strategies to address identified gaps in services, ensuring that MAT resources align with community needs.\n\n3. **Statute Citation:** W&I Code \u00a7 5830 (Source: [S1])\n   **Relevance:** This statute emphasizes the need for counties to evaluate the effectiveness of their behavioral health programs, including MAT services, to ensure they meet the needs of the community.\n   **Key Requirement:** Counties must regularly assess the performance of their programs and make necessary adjustments based on the identified needs and gaps in services.\n\n**No directly applicable statutes found in the provided list.**",
  "policy_analysis": "## Policy Context\n\n### Key Requirements\n- Counties must conduct a comprehensive assessment of current Medication-Assisted Treatment (MAT) resources, including programs and providers, to identify gaps in service delivery ([P1]).\n- The assessment must include an evaluation of the estimated needs for MAT services within the county ([P1]).\n- Counties are required to submit their findings and action plans to the Department of Health Care Services (DHCS) by the end of the fiscal year ([P1]).\n\n### Recommended Practices\n- Counties should engage stakeholders, including community organizations and MAT providers, in the assessment process to ensure a comprehensive understanding of local needs ([P2]).\n- It is encouraged that counties utilize data analytics tools to analyze service utilization trends and identify specific gaps in MAT resources ([P2]).\n- Counties may consider conducting surveys or focus groups with individuals seeking MAT services to gather qualitative data on barriers to access ([P3]).\n\n### Compliance Guidance\n- Counties should initiate the assessment process by compiling a list of existing MAT programs and providers, including their capacity and service offerings ([P1]).\n- Develop a framework for estimating the need for MAT services based on local population data, prevalence of substance use disorders, and existing service utilization rates ([P1]).\n- Document the assessment findings, including identified gaps and proposed strategies to address these gaps, and prepare a report for submission to DHCS by the specified deadline ([P1]).\n- Effective Date: Ongoing assessments should be updated annually, with the first report due by the end of the current fiscal year.\n\n### Related Policy Sections\n- Section 3.1: Substance Use Disorder Treatment Services\n- Section 5.2: Data Collection and Reporting Requirements\n\n### Ambiguities/Open Questions\n- Clarification is needed on the specific metrics or data sources that should be used to estimate the needs for MAT services.\n- There is uncertainty regarding the level of detail required in the action plans submitted to DHCS, which could affect compliance.",
  "final_response": "\u2705 **Good Quality** (Score: 8.6/10)\n\n## Compliance Summary\n\n### Bottom Line\nCounties must conduct a comprehensive assessment of current Medication-Assisted Treatment (MAT) resources and identify gaps in services to meet community needs. This assessment must be submitted to DHCS by the end of the fiscal year.\n\n### Statutory Basis\nW&I Code \u00a7 5899 requires counties to assess and report on mental health service availability, including MAT resources. W&I Code \u00a7 5892 mandates the development of strategies to address gaps in substance use disorder services, while W&I Code \u00a7 5830 emphasizes the need for regular evaluations of program effectiveness.\n\n### Policy Guidance\nCounties \"must\" conduct an assessment of MAT resources and \"should\" engage stakeholders and utilize data analytics for a thorough evaluation. The assessment should include a list of existing MAT programs, estimated community needs, and a report documenting findings and strategies for improvement.\n\n### Action Items for County\n1. Compile a list of existing MAT programs and providers, detailing their capacity and services offered (by March 2024).\n2. Develop a framework to estimate the need for MAT services based on local data, including substance use prevalence (by April 2024).\n3. Engage stakeholders, including community organizations and MAT providers, to gather insights on local needs and barriers (ongoing).\n4. Document assessment findings, including identified gaps and proposed strategies, and prepare a report for DHCS submission by the end of the fiscal year (by June 2024).\n5. Establish a plan for annual updates to the assessment to ensure ongoing compliance and responsiveness to community needs.\n\n### Open Questions / Ambiguities\n- Clarification is needed on specific metrics or data sources for estimating MAT service needs.\n- Uncertainty exists regarding the required detail level in action plans submitted to DHCS.\n\n---\n\n**Processing Metadata:**\n- Priority: High\n- Statute Confidence: Low\n- Policy Confidence: Low\n- Relevant Statutes: W&I Code \u00a7 5830, W&I Code \u00a7 5892, W&I Code \u00a7 5899\n- Revision Count: 0\n\n**Quality Issues Noted:**\n- Action item 2 could specify the data sources to be used for estimating needs.\n- Open questions section could benefit from more detail on the ambiguity regarding action plans.",
  "action_items": [
    "Compile a list of existing MAT programs and providers, detailing their capacity and services offered (by March 2024).",
    "Develop a framework to estimate the need for MAT services based on local data, including substance use prevalence (by April 2024).",
    "Engage stakeholders, including community organizations and MAT providers, to gather insights on local needs and barriers (ongoing).",
    "Document assessment findings, including identified gaps and proposed strategies, and prepare a report for DHCS submission by the end of the fiscal year (by June 2024).",
    "Establish a plan for annual updates to the assessment to ensure ongoing compliance and responsiveness to community needs."
  ],
  "priority": "High",
  "quality_score": 8.6,
  "passes_review": true,
  "metadata": {
    "statute_confidence": "Low",
    "policy_confidence": "Low",
    "relevant_statutes": [
      "W&I Code \u00a7 5830",
      "W&I Code \u00a7 5892",
      "W&I Code \u00a7 5899"
    ],
    "revision_count": 0,
    "quality_issues": [
      "Action item 2 could specify the data sources to be used for estimating needs.",
      "Open questions section could benefit from more detail on the ambiguity regarding action plans."
    ],
    "quality_suggestions": [
      "Add specific data sources or metrics to action item 2 for clarity.",
      "Expand on the open questions to provide more context on the uncertainties."
    ],
    "statute_chunks_retrieved": 0,
    "policy_chunks_retrieved": 0
  }
}