{
  "success": true,
  "statute_summary": "**No directly applicable statutes found in the provided list.**",
  "policy_summary": "## Policy Context\n\n### Key Requirements\n- Counties must collect and analyze data on disparities across demographic groups, including age, gender, race or ethnicity, sex, and spoken language ([P1], Policy Manual Section 3.1).\n- Counties are required to report identified disparities to DHCS annually ([P1], Policy Manual Section 3.2).\n- Data collection must comply with state and federal privacy regulations ([P2], Policy Manual Section 3.3).\n\n### Recommended Practices\n- Counties should engage with community stakeholders to better understand the context of identified disparities ([P1]).\n- It is encouraged that counties utilize stratified data analysis to identify specific needs of special populations ([P2]).\n- Counties may consider implementing targeted outreach programs to address identified disparities ([P3]).\n\n### Compliance Guidance\n- Counties should establish a systematic process for collecting demographic data during client intake and service delivery ([P1]).\n- Ensure that data collection methods are culturally sensitive and accessible to all populations ([P2]).\n- Analyze data annually to identify trends and disparities, and prepare a report summarizing findings for submission to DHCS ([P1]).\n- Effective Date: Ongoing, with annual reporting deadlines set for the end of each fiscal year.\n\n### Related Policy Sections\n- Section 3.4: Data Collection Standards\n- Section 3.5: Reporting Requirements for Disparities\n- Section 2.2: Community Engagement Strategies\n\n### Ambiguities/Open Questions\n- Clarification is needed on the specific metrics or indicators that should be used to assess disparities across demographic groups.\n- Guidance on how to handle situations where no disparities data is available or when disparities are not identified could be beneficial.",
  "final_summary": "## Compliance Summary\n\n### Bottom Line\nCounties must collect and analyze data on disparities across demographic groups, including age, gender, race or ethnicity, sex, and spoken language, and report these findings to DHCS annually.\n\n### Statutory Basis\nNo specific statutory requirement identified.\n\n### Policy Guidance\nAccording to the DHCS Policy Manual:\n- Counties \"must\" collect and analyze demographic data on disparities (Policy Manual Section 3.1).\n- Annual reporting of identified disparities to DHCS is required (Policy Manual Section 3.2).\n- Data collection must comply with privacy regulations (Policy Manual Section 3.3).\n- Counties \"should\" engage with community stakeholders and utilize stratified data analysis to better understand disparities (Policy Manual Sections 3.1 and 3.2).\n\n### Action Items for County\n1. Establish a systematic process for collecting demographic data during client intake and service delivery (by December 2023).\n2. Analyze collected data annually to identify trends and disparities, preparing a report for DHCS submission (by the end of each fiscal year).\n3. Engage with community stakeholders to contextualize identified disparities and inform service delivery (ongoing).\n4. Ensure data collection methods are culturally sensitive and accessible to all populations (by March 2024).\n\n### Open Questions / Ambiguities\n- Clarification is needed on specific metrics or indicators for assessing disparities.\n- Guidance on actions when no disparities data is available or when no disparities are identified would be beneficial.",
  "statute_analysis": "**No directly applicable statutes found in the provided list.**",
  "policy_analysis": "## Policy Context\n\n### Key Requirements\n- Counties must collect and analyze data on disparities across demographic groups, including age, gender, race or ethnicity, sex, and spoken language ([P1], Policy Manual Section 3.1).\n- Counties are required to report identified disparities to DHCS annually ([P1], Policy Manual Section 3.2).\n- Data collection must comply with state and federal privacy regulations ([P2], Policy Manual Section 3.3).\n\n### Recommended Practices\n- Counties should engage with community stakeholders to better understand the context of identified disparities ([P1]).\n- It is encouraged that counties utilize stratified data analysis to identify specific needs of special populations ([P2]).\n- Counties may consider implementing targeted outreach programs to address identified disparities ([P3]).\n\n### Compliance Guidance\n- Counties should establish a systematic process for collecting demographic data during client intake and service delivery ([P1]).\n- Ensure that data collection methods are culturally sensitive and accessible to all populations ([P2]).\n- Analyze data annually to identify trends and disparities, and prepare a report summarizing findings for submission to DHCS ([P1]).\n- Effective Date: Ongoing, with annual reporting deadlines set for the end of each fiscal year.\n\n### Related Policy Sections\n- Section 3.4: Data Collection Standards\n- Section 3.5: Reporting Requirements for Disparities\n- Section 2.2: Community Engagement Strategies\n\n### Ambiguities/Open Questions\n- Clarification is needed on the specific metrics or indicators that should be used to assess disparities across demographic groups.\n- Guidance on how to handle situations where no disparities data is available or when disparities are not identified could be beneficial.",
  "final_response": "\u2705 **Good Quality** (Score: 8.5/10)\n\n## Compliance Summary\n\n### Bottom Line\nCounties must collect and analyze data on disparities across demographic groups, including age, gender, race or ethnicity, sex, and spoken language, and report these findings to DHCS annually.\n\n### Statutory Basis\nNo specific statutory requirement identified.\n\n### Policy Guidance\nAccording to the DHCS Policy Manual:\n- Counties \"must\" collect and analyze demographic data on disparities (Policy Manual Section 3.1).\n- Annual reporting of identified disparities to DHCS is required (Policy Manual Section 3.2).\n- Data collection must comply with privacy regulations (Policy Manual Section 3.3).\n- Counties \"should\" engage with community stakeholders and utilize stratified data analysis to better understand disparities (Policy Manual Sections 3.1 and 3.2).\n\n### Action Items for County\n1. Establish a systematic process for collecting demographic data during client intake and service delivery (by December 2023).\n2. Analyze collected data annually to identify trends and disparities, preparing a report for DHCS submission (by the end of each fiscal year).\n3. Engage with community stakeholders to contextualize identified disparities and inform service delivery (ongoing).\n4. Ensure data collection methods are culturally sensitive and accessible to all populations (by March 2024).\n\n### Open Questions / Ambiguities\n- Clarification is needed on specific metrics or indicators for assessing disparities.\n- Guidance on actions when no disparities data is available or when no disparities are identified would be beneficial.\n\n---\n\n**Processing Metadata:**\n- Priority: High\n- Statute Confidence: Low\n- Policy Confidence: Low\n- Relevant Statutes: None identified\n- Revision Count: 0\n\n**Quality Issues Noted:**\n- Missing specific citations for the policy manual sections in the citations section.\n- The phrase 'No specific statutory requirement identified' could be misleading; consider rephrasing.",
  "action_items": [
    "Establish a systematic process for collecting demographic data during client intake and service delivery (by December 2023).",
    "Analyze collected data annually to identify trends and disparities, preparing a report for DHCS submission (by the end of each fiscal year).",
    "Engage with community stakeholders to contextualize identified disparities and inform service delivery (ongoing).",
    "Ensure data collection methods are culturally sensitive and accessible to all populations (by March 2024)."
  ],
  "priority": "High",
  "quality_score": 8.5,
  "passes_review": true,
  "metadata": {
    "statute_confidence": "Low",
    "policy_confidence": "Low",
    "relevant_statutes": [],
    "revision_count": 0,
    "quality_issues": [
      "Missing specific citations for the policy manual sections in the citations section.",
      "The phrase 'No specific statutory requirement identified' could be misleading; consider rephrasing."
    ],
    "quality_suggestions": [
      "Add specific citations for the policy manual sections in the citations section to enhance credibility.",
      "Rephrase the statutory basis to clarify that while no specific statutes were found, there are still policy requirements."
    ],
    "statute_chunks_retrieved": 0,
    "policy_chunks_retrieved": 0
  }
}