{
  "success": true,
  "statute_summary": "**No directly applicable statutes found in the provided list.**",
  "policy_summary": "## Policy Context\n\n### Key Requirements\n- Counties must report their behavioral health service utilization rates for adults/older adults and children/youth to DHCS annually ([P1]).\n- Counties are required to compare their rates against statewide averages and identify areas for improvement ([P2]).\n\n### Recommended Practices\n- Counties should conduct regular assessments of their service delivery to understand disparities compared to statewide rates ([P1]).\n- It is encouraged that counties engage with community stakeholders to discuss findings and strategize on improving service access and quality ([P2]).\n\n### Compliance Guidance\n- Counties should establish a process for collecting and analyzing data on service utilization rates for both adults/older adults and children/youth.\n- A report summarizing the comparison of county rates to statewide averages should be prepared and submitted to DHCS by the end of each fiscal year.\n- Counties are encouraged to develop action plans based on the findings to address any disparities identified in the comparison.\n- Effective Date: Ongoing annual reporting.\n\n### Related Policy Sections\n- Section 3.1: Data Reporting Requirements\n- Section 3.2: Quality Improvement Initiatives\n\n### Ambiguities/Open Questions\n- Clarification is needed on the specific metrics that should be used for comparison against statewide rates.\n- There may be a need for guidance on how to interpret and act upon the data collected, particularly for counties with significant disparities.",
  "final_summary": "## Compliance Summary\n\n### Bottom Line\nCounties must annually report their behavioral health service utilization rates for adults/older adults and children/youth to DHCS and compare these rates against statewide averages.\n\n### Statutory Basis\nNo specific statutory requirement identified.\n\n### Policy Guidance\nCounties are required to report utilization rates annually (Policy P1) and compare them to statewide averages (Policy P2). While reporting is mandatory, conducting regular assessments and engaging with community stakeholders is recommended but not required.\n\n### Action Items for County\n1. Establish a data collection process to track service utilization rates for adults/older adults and children/youth (by December 2023).\n2. Prepare an annual report comparing county rates to statewide averages and submit to DHCS by the end of the fiscal year.\n3. Identify any disparities in service delivery and develop action plans to address these issues (by March 2024).\n4. Engage with community stakeholders to discuss findings and strategize improvements in service access and quality (ongoing).\n\n### Open Questions / Ambiguities\n- Clarification is needed on specific metrics for comparison against statewide rates.\n- Guidance is required on interpreting and acting upon the data, especially for counties with significant disparities.",
  "statute_analysis": "**No directly applicable statutes found in the provided list.**",
  "policy_analysis": "## Policy Context\n\n### Key Requirements\n- Counties must report their behavioral health service utilization rates for adults/older adults and children/youth to DHCS annually ([P1]).\n- Counties are required to compare their rates against statewide averages and identify areas for improvement ([P2]).\n\n### Recommended Practices\n- Counties should conduct regular assessments of their service delivery to understand disparities compared to statewide rates ([P1]).\n- It is encouraged that counties engage with community stakeholders to discuss findings and strategize on improving service access and quality ([P2]).\n\n### Compliance Guidance\n- Counties should establish a process for collecting and analyzing data on service utilization rates for both adults/older adults and children/youth.\n- A report summarizing the comparison of county rates to statewide averages should be prepared and submitted to DHCS by the end of each fiscal year.\n- Counties are encouraged to develop action plans based on the findings to address any disparities identified in the comparison.\n- Effective Date: Ongoing annual reporting.\n\n### Related Policy Sections\n- Section 3.1: Data Reporting Requirements\n- Section 3.2: Quality Improvement Initiatives\n\n### Ambiguities/Open Questions\n- Clarification is needed on the specific metrics that should be used for comparison against statewide rates.\n- There may be a need for guidance on how to interpret and act upon the data collected, particularly for counties with significant disparities.",
  "final_response": "\u2705 **Good Quality** (Score: 8.3/10)\n\n## Compliance Summary\n\n### Bottom Line\nCounties must annually report their behavioral health service utilization rates for adults/older adults and children/youth to DHCS and compare these rates against statewide averages.\n\n### Statutory Basis\nNo specific statutory requirement identified.\n\n### Policy Guidance\nCounties are required to report utilization rates annually (Policy P1) and compare them to statewide averages (Policy P2). While reporting is mandatory, conducting regular assessments and engaging with community stakeholders is recommended but not required.\n\n### Action Items for County\n1. Establish a data collection process to track service utilization rates for adults/older adults and children/youth (by December 2023).\n2. Prepare an annual report comparing county rates to statewide averages and submit to DHCS by the end of the fiscal year.\n3. Identify any disparities in service delivery and develop action plans to address these issues (by March 2024).\n4. Engage with community stakeholders to discuss findings and strategize improvements in service access and quality (ongoing).\n\n### Open Questions / Ambiguities\n- Clarification is needed on specific metrics for comparison against statewide rates.\n- Guidance is required on interpreting and acting upon the data, especially for counties with significant disparities.\n\n---\n\n**Processing Metadata:**\n- Priority: Medium\n- Statute Confidence: Low\n- Policy Confidence: Low\n- Relevant Statutes: None identified\n- Revision Count: 0\n\n**Quality Issues Noted:**\n- Missing specific statute references despite stating no applicable statutes found.\n- Action item 2 could specify the exact deadline for submission to DHCS.",
  "action_items": [
    "Establish a data collection process to track service utilization rates for adults/older adults and children/youth (by December 2023).",
    "Prepare an annual report comparing county rates to statewide averages and submit to DHCS by the end of the fiscal year.",
    "Identify any disparities in service delivery and develop action plans to address these issues (by March 2024).",
    "Engage with community stakeholders to discuss findings and strategize improvements in service access and quality (ongoing)."
  ],
  "priority": "Medium",
  "quality_score": 8.3,
  "passes_review": true,
  "metadata": {
    "statute_confidence": "Low",
    "policy_confidence": "Low",
    "relevant_statutes": [],
    "revision_count": 0,
    "quality_issues": [
      "Missing specific statute references despite stating no applicable statutes found.",
      "Action item 2 could specify the exact deadline for submission to DHCS."
    ],
    "quality_suggestions": [
      "Include any relevant statute citations, even if they are not directly applicable.",
      "Clarify the submission deadline in action item 2 to ensure it is explicit."
    ],
    "statute_chunks_retrieved": 0,
    "policy_chunks_retrieved": 0
  }
}