{
  "success": true,
  "statute_summary": "**No directly applicable statutes found in the provided list.**",
  "policy_summary": "## Policy Context\n\n### Key Requirements\n- No specific mandatory requirements can be identified due to the absence of retrieved policy documents.\n\n### Recommended Practices\n- Without specific policy documents, no recommended practices can be outlined.\n\n### Compliance Guidance\n- Counties should proactively identify and document any implementation challenges or concerns related to program requirements. This could include issues such as resource limitations, workforce shortages, or barriers to accessing services.\n- Counties are encouraged to engage with stakeholders, including staff and community members, to gather insights on potential challenges and to develop strategies for addressing them.\n\n### Related Policy Sections\n- No related policy sections can be referenced due to the lack of retrieved documents.\n\n### Ambiguities/Open Questions\n- The absence of policy documents creates uncertainty regarding specific compliance requirements and recommended practices for counties.\n- Clarification is needed from DHCS on the expectations for counties to report implementation challenges, including the format and frequency of such disclosures.",
  "final_summary": "## Compliance Summary\n\n### Bottom Line\nCounties should proactively identify and document any implementation challenges or concerns related to program requirements, even though no specific statutory or policy mandates exist.\n\n### Statutory Basis\nNo specific statutory requirement identified.\n\n### Policy Guidance\nWhile there are no mandatory requirements outlined in policy documents, counties are encouraged to engage with stakeholders to identify challenges. This includes documenting issues such as resource limitations, workforce shortages, or barriers to accessing services. \n\n### Action Items for County\n1. Conduct a stakeholder meeting to gather insights on potential implementation challenges (by January 2024).\n2. Create a documentation process for recording identified challenges and concerns (by February 2024).\n3. Develop a strategy to address the documented challenges, including potential resource allocation or training needs (by March 2024).\n4. Share findings and strategies with county leadership and relevant stakeholders to ensure transparency and collaborative problem-solving (ongoing).\n\n### Open Questions / Ambiguities\n- Clarification is needed from DHCS on the expectations for counties to report implementation challenges, including the format and frequency of such disclosures.\n- What specific documentation is required, if any, for reporting these challenges?",
  "statute_analysis": "**No directly applicable statutes found in the provided list.**",
  "policy_analysis": "## Policy Context\n\n### Key Requirements\n- No specific mandatory requirements can be identified due to the absence of retrieved policy documents.\n\n### Recommended Practices\n- Without specific policy documents, no recommended practices can be outlined.\n\n### Compliance Guidance\n- Counties should proactively identify and document any implementation challenges or concerns related to program requirements. This could include issues such as resource limitations, workforce shortages, or barriers to accessing services.\n- Counties are encouraged to engage with stakeholders, including staff and community members, to gather insights on potential challenges and to develop strategies for addressing them.\n\n### Related Policy Sections\n- No related policy sections can be referenced due to the lack of retrieved documents.\n\n### Ambiguities/Open Questions\n- The absence of policy documents creates uncertainty regarding specific compliance requirements and recommended practices for counties.\n- Clarification is needed from DHCS on the expectations for counties to report implementation challenges, including the format and frequency of such disclosures.",
  "final_response": "\u2705 **Good Quality** (Score: 8.5/10)\n\n## Compliance Summary\n\n### Bottom Line\nCounties should proactively identify and document any implementation challenges or concerns related to program requirements, even though no specific statutory or policy mandates exist.\n\n### Statutory Basis\nNo specific statutory requirement identified.\n\n### Policy Guidance\nWhile there are no mandatory requirements outlined in policy documents, counties are encouraged to engage with stakeholders to identify challenges. This includes documenting issues such as resource limitations, workforce shortages, or barriers to accessing services. \n\n### Action Items for County\n1. Conduct a stakeholder meeting to gather insights on potential implementation challenges (by January 2024).\n2. Create a documentation process for recording identified challenges and concerns (by February 2024).\n3. Develop a strategy to address the documented challenges, including potential resource allocation or training needs (by March 2024).\n4. Share findings and strategies with county leadership and relevant stakeholders to ensure transparency and collaborative problem-solving (ongoing).\n\n### Open Questions / Ambiguities\n- Clarification is needed from DHCS on the expectations for counties to report implementation challenges, including the format and frequency of such disclosures.\n- What specific documentation is required, if any, for reporting these challenges?\n\n---\n\n**Processing Metadata:**\n- Priority: Medium\n- Statute Confidence: Low\n- Policy Confidence: Low\n- Relevant Statutes: None identified\n- Revision Count: 0\n\n**Quality Issues Noted:**\n- Action item 3 could be more specific regarding the strategy development process.\n- Citations for policy guidance could be improved with specific references.",
  "action_items": [
    "Conduct a stakeholder meeting to gather insights on potential implementation challenges (by January 2024).",
    "Create a documentation process for recording identified challenges and concerns (by February 2024).",
    "Develop a strategy to address the documented challenges, including potential resource allocation or training needs (by March 2024).",
    "Share findings and strategies with county leadership and relevant stakeholders to ensure transparency and collaborative problem-solving (ongoing)."
  ],
  "priority": "Medium",
  "quality_score": 8.5,
  "passes_review": true,
  "metadata": {
    "statute_confidence": "Low",
    "policy_confidence": "Low",
    "relevant_statutes": [],
    "revision_count": 0,
    "quality_issues": [
      "Action item 3 could be more specific regarding the strategy development process.",
      "Citations for policy guidance could be improved with specific references."
    ],
    "quality_suggestions": [
      "Clarify the specific steps involved in developing the strategy in action item 3.",
      "Include any relevant policy document references or guidance to strengthen citations."
    ],
    "statute_chunks_retrieved": 0,
    "policy_chunks_retrieved": 0
  }
}