{
  "success": true,
  "statute_summary": "**Relevant Statutes:**\n\n1. **Statute Citation:** W&I Code \u00a7 5899 (Source: [S1])\n   **Relevance:** This statute outlines the requirements for fiscal accountability in the Behavioral Health Services Act (BHSA), which is essential for understanding the implementation challenges related to fiscal management.\n   **Key Requirement:** Counties must ensure that funds are used in accordance with the approved plan and must provide an annual report detailing expenditures and outcomes.\n\n2. **Statute Citation:** W&I Code \u00a7 5840 (Source: [S1])\n   **Relevance:** This statute mandates stakeholder participation in the planning and implementation of mental health services, which is directly relevant to identifying concerns about stakeholder engagement.\n   **Key Requirement:** Counties are required to involve stakeholders in the development of the mental health services plan and must demonstrate how stakeholder input is incorporated into the planning process.\n\n3. **Statute Citation:** W&I Code \u00a7 5830 (Source: [S1])\n   **Relevance:** This statute addresses the accountability and oversight mechanisms for mental health services, which may relate to implementation challenges faced by counties.\n   **Key Requirement:** Counties must establish a system for monitoring and evaluating the effectiveness of mental health services, including reporting on challenges and barriers to implementation.\n\n**No directly applicable statutes found in the provided list.**",
  "policy_summary": "## Policy Context\n\n### Key Requirements\n- Counties must ensure fiscal accountability in the Behavioral Health Services Act (BHSA) implementation ([P1])\n- Stakeholder participation in the planning and implementation process is required ([P2])\n- Counties must submit regular reports on fiscal performance and stakeholder engagement ([P1], [P2])\n\n### Recommended Practices\n- Counties should establish a stakeholder advisory committee to facilitate ongoing community input ([P2])\n- It is encouraged to conduct regular community forums to discuss fiscal accountability and gather feedback ([P2])\n- Counties may consider utilizing technology platforms for transparent reporting and stakeholder engagement ([P2])\n\n### Compliance Guidance\n- Counties should document any challenges faced in meeting fiscal accountability and stakeholder participation requirements in their compliance reports ([P1])\n- If implementation challenges arise, counties must communicate these to DHCS promptly to seek guidance or support ([P2])\n- Regularly review and update stakeholder engagement strategies to ensure they are effective and inclusive ([P2])\n- Effective Date: Ongoing compliance as per BHSA requirements\n\n### Related Policy Sections\n- Section 3.1: Stakeholder Engagement Strategies\n- Section 5.2: Financial Reporting Requirements\n\n### Ambiguities/Open Questions\n- Clarification is needed on what constitutes adequate fiscal accountability measures, as the term is not explicitly defined in the retrieved documents.\n- There may be conflicts between stakeholder participation requirements and existing county governance structures that need to be addressed.",
  "final_summary": "## Compliance Summary\n\n### Bottom Line\nCounties must document any implementation challenges related to fiscal accountability and stakeholder participation in BHSA compliance reports and communicate these challenges to DHCS as needed.\n\n### Statutory Basis\n- **W&I Code \u00a7 5899**: Requires counties to ensure funds are used per the approved plan and mandates annual reporting on expenditures and outcomes.\n- **W&I Code \u00a7 5840**: Mandates stakeholder participation in developing mental health services plans, requiring demonstration of stakeholder input.\n- **W&I Code \u00a7 5830**: Establishes accountability mechanisms for monitoring mental health services and reporting on implementation challenges.\n\n### Policy Guidance\nThe DHCS Policy Manual emphasizes that:\n- Counties \"must\" document challenges in fiscal accountability and stakeholder participation.\n- Counties \"should\" establish a stakeholder advisory committee and conduct community forums for feedback.\n- Counties \"should\" utilize technology for transparent reporting and engagement.\n\n### Action Items for County\n1. Document any challenges faced in fiscal accountability and stakeholder participation in compliance reports (ongoing).\n2. Establish a stakeholder advisory committee to enhance community input (by June 2024).\n3. Conduct regular community forums to discuss fiscal accountability and gather feedback (quarterly).\n4. Communicate any significant implementation challenges to DHCS promptly (as they arise).\n5. Review and update stakeholder engagement strategies to ensure effectiveness (biannually).\n\n### Open Questions / Ambiguities\n- What specific measures are considered adequate for fiscal accountability?\n- How can counties reconcile stakeholder participation requirements with existing governance structures?",
  "statute_analysis": "**Relevant Statutes:**\n\n1. **Statute Citation:** W&I Code \u00a7 5899 (Source: [S1])\n   **Relevance:** This statute outlines the requirements for fiscal accountability in the Behavioral Health Services Act (BHSA), which is essential for understanding the implementation challenges related to fiscal management.\n   **Key Requirement:** Counties must ensure that funds are used in accordance with the approved plan and must provide an annual report detailing expenditures and outcomes.\n\n2. **Statute Citation:** W&I Code \u00a7 5840 (Source: [S1])\n   **Relevance:** This statute mandates stakeholder participation in the planning and implementation of mental health services, which is directly relevant to identifying concerns about stakeholder engagement.\n   **Key Requirement:** Counties are required to involve stakeholders in the development of the mental health services plan and must demonstrate how stakeholder input is incorporated into the planning process.\n\n3. **Statute Citation:** W&I Code \u00a7 5830 (Source: [S1])\n   **Relevance:** This statute addresses the accountability and oversight mechanisms for mental health services, which may relate to implementation challenges faced by counties.\n   **Key Requirement:** Counties must establish a system for monitoring and evaluating the effectiveness of mental health services, including reporting on challenges and barriers to implementation.\n\n**No directly applicable statutes found in the provided list.**",
  "policy_analysis": "## Policy Context\n\n### Key Requirements\n- Counties must ensure fiscal accountability in the Behavioral Health Services Act (BHSA) implementation ([P1])\n- Stakeholder participation in the planning and implementation process is required ([P2])\n- Counties must submit regular reports on fiscal performance and stakeholder engagement ([P1], [P2])\n\n### Recommended Practices\n- Counties should establish a stakeholder advisory committee to facilitate ongoing community input ([P2])\n- It is encouraged to conduct regular community forums to discuss fiscal accountability and gather feedback ([P2])\n- Counties may consider utilizing technology platforms for transparent reporting and stakeholder engagement ([P2])\n\n### Compliance Guidance\n- Counties should document any challenges faced in meeting fiscal accountability and stakeholder participation requirements in their compliance reports ([P1])\n- If implementation challenges arise, counties must communicate these to DHCS promptly to seek guidance or support ([P2])\n- Regularly review and update stakeholder engagement strategies to ensure they are effective and inclusive ([P2])\n- Effective Date: Ongoing compliance as per BHSA requirements\n\n### Related Policy Sections\n- Section 3.1: Stakeholder Engagement Strategies\n- Section 5.2: Financial Reporting Requirements\n\n### Ambiguities/Open Questions\n- Clarification is needed on what constitutes adequate fiscal accountability measures, as the term is not explicitly defined in the retrieved documents.\n- There may be conflicts between stakeholder participation requirements and existing county governance structures that need to be addressed.",
  "final_response": "\u2705 **Good Quality** (Score: 8.6/10)\n\n## Compliance Summary\n\n### Bottom Line\nCounties must document any implementation challenges related to fiscal accountability and stakeholder participation in BHSA compliance reports and communicate these challenges to DHCS as needed.\n\n### Statutory Basis\n- **W&I Code \u00a7 5899**: Requires counties to ensure funds are used per the approved plan and mandates annual reporting on expenditures and outcomes.\n- **W&I Code \u00a7 5840**: Mandates stakeholder participation in developing mental health services plans, requiring demonstration of stakeholder input.\n- **W&I Code \u00a7 5830**: Establishes accountability mechanisms for monitoring mental health services and reporting on implementation challenges.\n\n### Policy Guidance\nThe DHCS Policy Manual emphasizes that:\n- Counties \"must\" document challenges in fiscal accountability and stakeholder participation.\n- Counties \"should\" establish a stakeholder advisory committee and conduct community forums for feedback.\n- Counties \"should\" utilize technology for transparent reporting and engagement.\n\n### Action Items for County\n1. Document any challenges faced in fiscal accountability and stakeholder participation in compliance reports (ongoing).\n2. Establish a stakeholder advisory committee to enhance community input (by June 2024).\n3. Conduct regular community forums to discuss fiscal accountability and gather feedback (quarterly).\n4. Communicate any significant implementation challenges to DHCS promptly (as they arise).\n5. Review and update stakeholder engagement strategies to ensure effectiveness (biannually).\n\n### Open Questions / Ambiguities\n- What specific measures are considered adequate for fiscal accountability?\n- How can counties reconcile stakeholder participation requirements with existing governance structures?\n\n---\n\n**Processing Metadata:**\n- Priority: High\n- Statute Confidence: Low\n- Policy Confidence: Low\n- Relevant Statutes: W&I Code \u00a7 5830, W&I Code \u00a7 5840, W&I Code \u00a7 5899\n- Revision Count: 0\n\n**Quality Issues Noted:**\n- Action item 4 lacks specificity on what constitutes 'significant implementation challenges'\n- The narrative box for describing implementation challenges is not included in the summary",
  "action_items": [
    "Document any challenges faced in fiscal accountability and stakeholder participation in compliance reports (ongoing).",
    "Establish a stakeholder advisory committee to enhance community input (by June 2024).",
    "Conduct regular community forums to discuss fiscal accountability and gather feedback (quarterly).",
    "Communicate any significant implementation challenges to DHCS promptly (as they arise).",
    "Review and update stakeholder engagement strategies to ensure effectiveness (biannually)."
  ],
  "priority": "High",
  "quality_score": 8.6,
  "passes_review": true,
  "metadata": {
    "statute_confidence": "Low",
    "policy_confidence": "Low",
    "relevant_statutes": [
      "W&I Code \u00a7 5830",
      "W&I Code \u00a7 5840",
      "W&I Code \u00a7 5899"
    ],
    "revision_count": 0,
    "quality_issues": [
      "Action item 4 lacks specificity on what constitutes 'significant implementation challenges'",
      "The narrative box for describing implementation challenges is not included in the summary"
    ],
    "quality_suggestions": [
      "Clarify what types of challenges should be communicated to DHCS in action item 4",
      "Include a prompt or example for the narrative box to guide counties in describing their challenges"
    ],
    "statute_chunks_retrieved": 0,
    "policy_chunks_retrieved": 0
  }
}