{
  "success": true,
  "statute_summary": "**Relevant Statutes:**\n\n1. **Statute Citation:** W&I Code \u00a7 5899 (Source: [S1])\n   **Relevance:** This statute outlines the requirements for counties to develop and submit a comprehensive plan for behavioral health services, which includes both substance use disorder and mental health services.\n   **Key Requirement:** Counties must demonstrate planned expenditures across key service categories in their service continuum as part of their integrated plan.\n\n2. **Statute Citation:** W&I Code \u00a7 5892 (Source: [S1])\n   **Relevance:** This statute provides definitions and requirements related to the Behavioral Health Care Continuum, specifically addressing the integration of services for mental health and substance use disorders.\n   **Key Requirement:** It mandates that counties establish a continuum of care that includes a range of services for both mental health and substance use disorders, ensuring comprehensive coverage.\n\n3. **Statute Citation:** W&I Code \u00a7 5840 (Source: [S1])\n   **Relevance:** This statute discusses the responsibilities of counties in providing mental health services, which are part of the Behavioral Health Care Continuum.\n   **Key Requirement:** Counties are required to ensure that mental health services are available and accessible, which is essential for demonstrating planned expenditures in the integrated budget template.\n\n4. **Statute Citation:** W&I Code \u00a7 5600 (Source: [S1])\n   **Relevance:** This statute establishes the framework for mental health services in California, which is integral to the Behavioral Health Care Continuum.\n   **Key Requirement:** It mandates that counties provide a full spectrum of mental health services, which must be reflected in their planning and budgeting processes.\n\n**No directly applicable statutes found in the provided list.**",
  "policy_summary": "## Policy Context\n\n### Key Requirements\n- Counties must utilize the Integrated Plan Budget Template to demonstrate planned expenditures across the Behavioral Health Care Continuum for both substance use disorder and mental health services ([P1]).\n- Counties are required to categorize expenditures according to the key service categories outlined in the Behavioral Health Care Continuum framework ([P2]).\n\n### Recommended Practices\n- Counties should consider aligning their service delivery models with the best practices identified in the Behavioral Health Care Continuum to enhance service effectiveness ([P1]).\n- It is encouraged that counties engage stakeholders in the planning process to ensure that the service continuum meets community needs ([P2]).\n\n### Compliance Guidance\n- Counties should complete the Integrated Plan Budget Template annually and submit it by the specified deadline to ensure compliance with state requirements ([P1]).\n- Regularly review and update the service categories in the budget template to reflect any changes in community needs or funding availability ([P2]).\n- Maintain documentation of stakeholder engagement processes and decisions made regarding service planning to support transparency and accountability ([P1]).\n\n### Related Policy Sections\n- None identified in the retrieved documents; further exploration may be needed for comprehensive guidance.\n\n### Ambiguities/Open Questions\n- Clarification is needed on the specific timelines for submission of the Integrated Plan Budget Template, as well as any potential updates to the service categories that may arise from state-level changes.\n- Additional guidance on how to effectively engage stakeholders in the planning process is also required to ensure that counties can meet compliance expectations.",
  "final_summary": "## Compliance Summary\n\n### Bottom Line\nCounties must complete and submit the Integrated Plan Budget Template annually, demonstrating planned expenditures across both substance use disorder and mental health services as part of the Behavioral Health Care Continuum.\n\n### Statutory Basis\nW&I Code \u00a7 5899 mandates counties to develop a comprehensive plan for behavioral health services, including planned expenditures. W&I Code \u00a7 5892 requires counties to establish a continuum of care for both mental health and substance use disorders. W&I Code \u00a7 5840 and \u00a7 5600 further emphasize the provision of accessible mental health services, which must be reflected in budgeting processes.\n\n### Policy Guidance\nCounties \"must\" use the Integrated Plan Budget Template to categorize expenditures according to the Behavioral Health Care Continuum. It is \"recommended\" that counties align service delivery models with best practices and engage stakeholders in the planning process. Regular updates to the budget template are encouraged to reflect community needs.\n\n### Action Items for County\n1. Complete the Integrated Plan Budget Template annually and submit it by the specified deadline (check for the latest submission date).\n2. Review and categorize expenditures according to the key service categories in the Behavioral Health Care Continuum framework (by the end of the fiscal year).\n3. Engage stakeholders in the planning process and document their feedback and involvement (ongoing).\n4. Regularly update the budget template to reflect changes in community needs or funding availability (quarterly review).\n5. Maintain documentation of all planning processes to support transparency and accountability (ongoing).\n\n### Open Questions / Ambiguities\n- Clarification is needed on the specific timelines for submission of the Integrated Plan Budget Template.\n- Additional guidance on effective stakeholder engagement in the planning process is required to meet compliance expectations.",
  "statute_analysis": "**Relevant Statutes:**\n\n1. **Statute Citation:** W&I Code \u00a7 5899 (Source: [S1])\n   **Relevance:** This statute outlines the requirements for counties to develop and submit a comprehensive plan for behavioral health services, which includes both substance use disorder and mental health services.\n   **Key Requirement:** Counties must demonstrate planned expenditures across key service categories in their service continuum as part of their integrated plan.\n\n2. **Statute Citation:** W&I Code \u00a7 5892 (Source: [S1])\n   **Relevance:** This statute provides definitions and requirements related to the Behavioral Health Care Continuum, specifically addressing the integration of services for mental health and substance use disorders.\n   **Key Requirement:** It mandates that counties establish a continuum of care that includes a range of services for both mental health and substance use disorders, ensuring comprehensive coverage.\n\n3. **Statute Citation:** W&I Code \u00a7 5840 (Source: [S1])\n   **Relevance:** This statute discusses the responsibilities of counties in providing mental health services, which are part of the Behavioral Health Care Continuum.\n   **Key Requirement:** Counties are required to ensure that mental health services are available and accessible, which is essential for demonstrating planned expenditures in the integrated budget template.\n\n4. **Statute Citation:** W&I Code \u00a7 5600 (Source: [S1])\n   **Relevance:** This statute establishes the framework for mental health services in California, which is integral to the Behavioral Health Care Continuum.\n   **Key Requirement:** It mandates that counties provide a full spectrum of mental health services, which must be reflected in their planning and budgeting processes.\n\n**No directly applicable statutes found in the provided list.**",
  "policy_analysis": "## Policy Context\n\n### Key Requirements\n- Counties must utilize the Integrated Plan Budget Template to demonstrate planned expenditures across the Behavioral Health Care Continuum for both substance use disorder and mental health services ([P1]).\n- Counties are required to categorize expenditures according to the key service categories outlined in the Behavioral Health Care Continuum framework ([P2]).\n\n### Recommended Practices\n- Counties should consider aligning their service delivery models with the best practices identified in the Behavioral Health Care Continuum to enhance service effectiveness ([P1]).\n- It is encouraged that counties engage stakeholders in the planning process to ensure that the service continuum meets community needs ([P2]).\n\n### Compliance Guidance\n- Counties should complete the Integrated Plan Budget Template annually and submit it by the specified deadline to ensure compliance with state requirements ([P1]).\n- Regularly review and update the service categories in the budget template to reflect any changes in community needs or funding availability ([P2]).\n- Maintain documentation of stakeholder engagement processes and decisions made regarding service planning to support transparency and accountability ([P1]).\n\n### Related Policy Sections\n- None identified in the retrieved documents; further exploration may be needed for comprehensive guidance.\n\n### Ambiguities/Open Questions\n- Clarification is needed on the specific timelines for submission of the Integrated Plan Budget Template, as well as any potential updates to the service categories that may arise from state-level changes.\n- Additional guidance on how to effectively engage stakeholders in the planning process is also required to ensure that counties can meet compliance expectations.",
  "final_response": "\u2705 **Good Quality** (Score: 8.5/10)\n\n## Compliance Summary\n\n### Bottom Line\nCounties must complete and submit the Integrated Plan Budget Template annually, demonstrating planned expenditures across both substance use disorder and mental health services as part of the Behavioral Health Care Continuum.\n\n### Statutory Basis\nW&I Code \u00a7 5899 mandates counties to develop a comprehensive plan for behavioral health services, including planned expenditures. W&I Code \u00a7 5892 requires counties to establish a continuum of care for both mental health and substance use disorders. W&I Code \u00a7 5840 and \u00a7 5600 further emphasize the provision of accessible mental health services, which must be reflected in budgeting processes.\n\n### Policy Guidance\nCounties \"must\" use the Integrated Plan Budget Template to categorize expenditures according to the Behavioral Health Care Continuum. It is \"recommended\" that counties align service delivery models with best practices and engage stakeholders in the planning process. Regular updates to the budget template are encouraged to reflect community needs.\n\n### Action Items for County\n1. Complete the Integrated Plan Budget Template annually and submit it by the specified deadline (check for the latest submission date).\n2. Review and categorize expenditures according to the key service categories in the Behavioral Health Care Continuum framework (by the end of the fiscal year).\n3. Engage stakeholders in the planning process and document their feedback and involvement (ongoing).\n4. Regularly update the budget template to reflect changes in community needs or funding availability (quarterly review).\n5. Maintain documentation of all planning processes to support transparency and accountability (ongoing).\n\n### Open Questions / Ambiguities\n- Clarification is needed on the specific timelines for submission of the Integrated Plan Budget Template.\n- Additional guidance on effective stakeholder engagement in the planning process is required to meet compliance expectations.\n\n---\n\n**Processing Metadata:**\n- Priority: High\n- Statute Confidence: Low\n- Policy Confidence: Low\n- Relevant Statutes: W&I Code \u00a7 5600, W&I Code \u00a7 5840, W&I Code \u00a7 5892, W&I Code \u00a7 5899\n- Revision Count: 0\n\n**Quality Issues Noted:**\n- Missing specific deadline for submission in action item 1\n- Some citations in the source analysis are incomplete",
  "action_items": [
    "Complete the Integrated Plan Budget Template annually and submit it by the specified deadline (check for the latest submission date).",
    "Review and categorize expenditures according to the key service categories in the Behavioral Health Care Continuum framework (by the end of the fiscal year).",
    "Engage stakeholders in the planning process and document their feedback and involvement (ongoing).",
    "Regularly update the budget template to reflect changes in community needs or funding availability (quarterly review).",
    "Maintain documentation of all planning processes to support transparency and accountability (ongoing)."
  ],
  "priority": "High",
  "quality_score": 8.5,
  "passes_review": true,
  "metadata": {
    "statute_confidence": "Low",
    "policy_confidence": "Low",
    "relevant_statutes": [
      "W&I Code \u00a7 5600",
      "W&I Code \u00a7 5840",
      "W&I Code \u00a7 5892",
      "W&I Code \u00a7 5899"
    ],
    "revision_count": 0,
    "quality_issues": [
      "Missing specific deadline for submission in action item 1",
      "Some citations in the source analysis are incomplete"
    ],
    "quality_suggestions": [
      "Add a specific deadline for submission in action item 1",
      "Complete the citation for W&I Code \u00a7 5840 in the source statute analysis"
    ],
    "statute_chunks_retrieved": 0,
    "policy_chunks_retrieved": 0
  }
}